"url","name","location","rating","review"
"http://www.ulta.com/colorstay-16-hour-eyeshadow?productId=VP10281","Smilemakers","Port St.Lucie,FL",4,"I use the product everyday. Long-lasting and very silky texture. I love it!"
"http://www.ulta.com/colorstay-16-hour-eyeshadow?productId=VP10281","KJ","Peoria, AZ",5,"I have several of these 12-hour eye shadows - I love the colors."
"http://www.ulta.com/colorstay-16-hour-eyeshadow?productId=VP10281","Gaby","Florida",2,"Not pigmented enough, chalky."
"http://www.ulta.com/colorstay-16-hour-eyeshadow?productId=VP10281","lupis","Houston, TX",4,"I use this product every day to going to work."
"http://www.ulta.com/colorstay-16-hour-eyeshadow?productId=VP10281","soccer mom","atlanta, ga",3,"I saw this for sale when checking out so picked it up. It actually is a nice natural look."
"http://www.ulta.com/colorstay-16-hour-eyeshadow?productId=VP10281","Jen","Montana",1,"I've used Revlon ColorStay eye shadow for years and really like it. For some reason, this particular color pallet did not go on well. One of the colors was chunky, did not blend at all, and left glitter all over my face. <br /><br />I returned it."
"http://www.ulta.com/colorstay-16-hour-eyeshadow?productId=VP10281","kstrunk","South Bend, Indiana",4,"I tried this when Ulta was having a 40% off sale on Revlon makeup.  I'm so glad I did!  Really love the colors."
"http://www.ulta.com/colorstay-16-hour-eyeshadow?productId=VP10281","Kimi","Naperville, IL",4,"I use it every day"
"http://www.ulta.com/colorstay-16-hour-eyeshadow?productId=VP10281","Duffy","Oregon",5,"I bought this palette in Addictive and I love it. The colors are great on my fair skin and make a great natural eye that I can wear every day. The product applies evenly and blends well. I would recommend this product."
"http://www.ulta.com/colorstay-16-hour-eyeshadow?productId=VP10281","MARIA","ARLINGTON HTS, IL",4,"One small compact gives you all the colors you need for eyelid make up."
"http://www.ulta.com/colorstay-16-hour-eyeshadow?productId=VP10281","Beth the cook","Sparks Nevada",5,"I really enjoy this product and would recommend it to everyone"
"http://www.ulta.com/colorstay-16-hour-eyeshadow?productId=VP10281","Tilly Whirls","Reston, VA",3,"I really like the purples I got in this compact. I bought the Precocious color set. It's got a silver, dark gray, light purple and medium/dark purple. It's great for doing a lighter version of a smokey eye and for everyday wear. When I got home I realized the compact I picked up at the store was broken. I took of the sticker that sealed it and the entire top popped off because it was broken, but I exchanged it easily the next day. Hopefully it was a fluke and the cases don't break that easily. Anyway, great colors for everyday wear."
"http://www.ulta.com/colorstay-16-hour-eyeshadow?productId=VP10281","Jackie","Altoona,PA",5,"no comment"
"http://www.ulta.com/colorstay-16-hour-eyeshadow?productId=VP10281","pirie226","Thousand Oaks, CA",2,"I gave this two stars as it performs differently when applied wet, when the less sparkly colors do last quite a while, although it makes them more difficult to blend.  Revlon keeps lapsing further and further toward sparkly, shiny makeup, and this product is no exception.  Applied dry, it goes on chalky and flaky.  By midmorning, my whole eye area and upper cheeks were a sparkly mess of migrating shadow."
"http://www.ulta.com/colorstay-16-hour-eyeshadow?productId=VP10281","CJ","Texas",4,"I really liked this product! I read about it in allure and decided to try it and actually ended up using it on my wedding day. It stayed on long and the color I chose really gave me a natural look."
"http://www.ulta.com/colorstay-16-hour-eyeshadow?productId=VP10281","Sunshine24","Dallas, Texas",4,"Use for work and play- nice color- I'd compare it to Too Faced. They quit making a pink color I like, so I tried this.  The pink is a pretty shade, but I'm afraid it won't last very long."
"http://www.ulta.com/colorstay-16-hour-eyeshadow?productId=VP10281","Beegrrl","Phoenix, AZ",2,"I was in a financial pinch and needed a reasonably priced eyeshadow.  I bought this and liked the copper color, but other than that, it was hard to blend, was too powdery and the pigment faded quickly."
"http://www.ulta.com/colorstay-16-hour-eyeshadow?productId=VP10281","KT","Chicago, IL",5,"I like this product. It goes on smoothly and lasts a long time.  I only have a problem with the case breaking at the hinge end."
"http://www.ulta.com/colorstay-16-hour-eyeshadow?productId=VP10281","Dee","Gettysburg, PA",4,"Good everyday use or more dramatic night-time use."
"http://www.ulta.com/colorstay-16-hour-eyeshadow?productId=VP10281","pattycake","chicago illinois",3,"good everyday shadow, not to pricey!"
"http://www.ulta.com/colorstay-16-hour-eyeshadow?productId=VP10281","jbsouth","Charlotte, NC",4,"I use this every day and the color stays on all day and still looks great when I get home from work. I use the same product for going out, just add some darker color. The purple in the set that I have makes me look like I've got a black eye :( kudos to anyone who can use the purple. This is probably my new favorite shadow and it will be a long time before I consider switching brands."
"http://www.ulta.com/colorstay-16-hour-eyeshadow?productId=VP10281","gaby","Alexandria,Va",5,"love the colors, and I have used this products for years"
"http://www.ulta.com/colorstay-16-hour-eyeshadow?productId=VP10281","Ninergirl","Keizer,OR",4,"I like this product the eye shadow is very pretty and goes with a lot of different outfits."
"http://www.ulta.com/colorstay-16-hour-eyeshadow?productId=VP10281","Lori","Wichita Falls, TX",4,"This eyeshadow applies easily and lasts quite some time.  I have VERY oily skin, and it manages to last much longer than the average eyeshadow."
"http://www.ulta.com/colorstay-16-hour-eyeshadow?productId=VP10281","jam1957","Wetumpka Al",5,"Love it"
"http://www.ulta.com/colorstay-16-hour-eyeshadow?productId=VP10281","speaker","NC",4,"Blends nicely and lasts all day without creasing.  I can hope for no more."
"http://www.ulta.com/colorstay-16-hour-eyeshadow?productId=VP10281","Nick","Chicago",4,"Very nice colors. You can mix without any problem and the result will be fantastic."
"http://www.ulta.com/colorstay-16-hour-eyeshadow?productId=VP10281","Linda","Littleton, CO",4,"I love the color and the wear of the eyeshadow."
"http://www.ulta.com/colorstay-16-hour-eyeshadow?productId=VP10281","Coach K","Alpharetta, GA",2,"Just too glittery for anything but a special night out.  The foam applicators are much too small and skinny to be useful at all.  Had to buy new foam applicators."
"http://www.ulta.com/colorstay-16-hour-eyeshadow?productId=VP10281","Shiney Hair","Painesville oHIO",5,"i USE THE PRODUCTE EVERY DAY."
"http://www.ulta.com/colorstay-16-hour-eyeshadow?productId=VP10281","Gigimac","Texas",4,"I prefer to use a makeup brush rather than the little foam applicators that come with the compact. Those never work as well for me."
"http://www.ulta.com/colorstay-16-hour-eyeshadow?productId=VP10281","(:","Pottsville pa",5,"The product is very good, even when I run after a day at school and doesn't smear or run because of sweat."
"http://www.ulta.com/colorstay-16-hour-eyeshadow?productId=VP10281","mary g","Bourbonnais, IL",5,"I love Revlon product.   It wears and applies well."
"http://www.ulta.com/colorstay-16-hour-eyeshadow?productId=VP10281","Jewels","Tampa FL",5,"I would wear this everyday If I could"
"http://www.ulta.com/colorstay-16-hour-eyeshadow?productId=VP10281","Jeannie","Wappingers Falls, New York",5,"I tried several stores to purchase these colors - none of them had them.  I had purchased them in these stores before so I thought they may have discontinued colors.  Went on line and found you - so I purchased three of them.  I so hope they are not discontining - this is all I wear."
"http://www.ulta.com/colorstay-16-hour-eyeshadow?productId=VP10281","Ramona","Elgin, IL",3,"I use these colors under the brow, with slightly darker shades (from another set by Revlon)on lid and in crease.  I like the different shades--pink, beige, grey tones.  The only thing I'm not too happy about is that as you use it there are flakes that end up crossing into the other colors."
"http://www.ulta.com/colorstay-16-hour-eyeshadow?productId=VP10281","Christy","Apple Valley, MN",5,"I like this brand for eyeshadows."
"http://www.ulta.com/colorstay-16-hour-eyeshadow?productId=VP10281","Autumn Flame","Lubbock, TX",4,"I was hesitant to purchase a &quot;lower-end&quot; eyeshadow but really didn't want to spend the department store prices that day. I opted for this set because of the natural pinks and I was using it for a business meeting. I wear it at least twice a week now and will buy more Revlon in the future!"
"http://www.ulta.com/colorstay-16-hour-eyeshadow?productId=VP10281","jt","Phoenix, Az",5,"Can't beat the price for this long lasting eyeshadow."
"http://www.ulta.com/colorstay-16-hour-eyeshadow?productId=VP10281","pa chocolate fan","Broken Arrow, OK",4,"Good product for the price."
"http://www.ulta.com/colorstay-16-hour-eyeshadow?productId=VP10281","bev","Alexandria, va",5,"Very easy to apply, didn't fade, just a great product."
"http://www.ulta.com/colorstay-16-hour-eyeshadow?productId=VP10281","lala0566","South Texas",5,"I love the colors on this and all of thier other color pallets, very easy to blend and the colors just make it so easy to blend them."
"http://www.ulta.com/colorstay-16-hour-eyeshadow?productId=VP10281","Robin","Savannah, GA",5,"My daughter let me know that these colors work well with my blue eyes."
"http://www.ulta.com/colorstay-16-hour-eyeshadow?productId=VP10281","WD","AZ",1,"does not apply smoothly"
"http://www.ulta.com/colorstay-16-hour-eyeshadow?productId=VP10281","Liz","Port St. Lucie, FL",4,"I loved how easily the colors blended and how many different ways I can use the palette. I use the dark colors for evening and then use the darker color in the crease of the outer edge of the eye for depth during the day."
"http://www.ulta.com/colorstay-16-hour-eyeshadow?productId=VP10281","Heather","Houston, TX",5,"for the price its a great product. lasts all day"
"http://www.ulta.com/colorstay-16-hour-eyeshadow?productId=VP10281","Kat","Gulfport, MS",4,"Love the colors! After you apply them they are not nearly as dark as they are in the compact. They blend very well though, I just choose the colors to be darker when applied."
"http://www.ulta.com/colorstay-16-hour-eyeshadow?productId=VP10281","Teacher","Des Moines, IA",5,"This is great. I love the colors and they are so natural that I use it every day and night. It's not sparkly or shiny like most metallic shadows."
"http://www.ulta.com/colorstay-16-hour-eyeshadow?productId=VP10281","Gardenia lover","Orlando, FL",4,"I bought two of these - one in Starlight and one in Sandstorm. They are like two extremes - the Starlight palette is all very light and shimmery, whereas the Sandstorm (which is NOT the same texture as picture, but rather the embossed style) was all very midtone. I've been trying to learn how do to eyeshadow properly, with the darkest shade in the crease, midtone on the lid, and highlight on the browbone, and I don't feel like there's enough variation within the individual compacts to pull that off. Using them together works, oddly enough.<br /><br />That being said, this is the first pressed eyeshadow I've bought in years (was using loose minerals) and the quality of the product is great. It goes on smooth and stays put. I'm sure I'll eventually figure out this color situation!"
"http://www.ulta.com/colorstay-16-hour-eyeshadow?productId=VP10281","skinidippn","Chattanooga, TN",5,"I bought this on a whim and ended up scoring BIG TIME!  Great colors, smooth and silky, inexpensive.  It was a WIN-WIN all the way around!"
"http://www.ulta.com/colorstay-16-hour-eyeshadow?productId=VP10281","Falgalla","Carlisle, PA",5,"I've used this product for everyday use for the last few years. Love it and hope it never gets discontinued!!"
"http://www.ulta.com/colorstay-16-hour-eyeshadow?productId=VP10281","K","The Woodlands, TX",4,"I have tried every brand of eyeshadow ever made and definitely like this one the best"
"http://www.ulta.com/colorstay-16-hour-eyeshadow?productId=VP10281","Lin","WBL Mn",5,"Looks good with most outfits"
"http://www.ulta.com/colorstay-16-hour-eyeshadow?productId=VP10281","Kaye","Dallas, Tx",5,"I've used this product for years and love it. Hope they never stop making it!"
"http://www.ulta.com/colorstay-16-hour-eyeshadow?productId=VP10281","I love this product!","Florida",5,"I use it daily."
"http://www.ulta.com/colorstay-16-hour-eyeshadow?productId=VP10281","Bonnie","Palm Harbor, FL",5,"Always a nice look and great for every day."
"http://www.ulta.com/colorstay-16-hour-eyeshadow?productId=VP10281","Anna","Shreveport,  la",2,"The colors are flat, needs more sparkle"
"http://www.ulta.com/colorstay-16-hour-eyeshadow?productId=VP10281","Cappy","Illinois",5,"Good contrast to the shadows that gather around our eyes as we age. My skin gets brownish shadows and silver offsets this nicely."
"http://www.ulta.com/colorstay-16-hour-eyeshadow?productId=VP10281","Lady T","Salt Lake City, Utah",5,"Color combinations and staying on power!"
"http://www.ulta.com/colorstay-16-hour-eyeshadow?productId=VP10281","Del","Texas",5,"Daily makeup"
"http://www.ulta.com/colorstay-16-hour-eyeshadow?productId=VP10281","Bell","Tampa, FL",1,"The four colors in this palette all look the same on my lid. I am not great with eye makeup so I applied as the package diagram suggests. The darker crease shade looked the same as the lid shade and brow bone highlighter. Maybe I should have applied multiple layers but that's not what I am looking for in a product."
"http://www.ulta.com/colorstay-16-hour-eyeshadow?productId=VP10281","Jules","San Dimas, Ca",5,"I am impressed at how beautiful the color is."
"http://www.ulta.com/colorstay-16-hour-eyeshadow?productId=VP10281","North Dallas Girl","Antioch, CA",5,"Love it, great colors."
"http://www.ulta.com/colorstay-16-hour-eyeshadow?productId=VP10281","Go getter","Dallas, TX",2,"No staying power.. Product not &quot;luscious&quot;."
"http://www.ulta.com/colorstay-16-hour-eyeshadow?productId=VP10281","Tanya","ga",5,"Love this product"
"http://www.ulta.com/colorstay-16-hour-eyeshadow?productId=VP10281","TRISH","STATESVILLE NC",2,"Did not hold up all day"
"http://www.ulta.com/colorstay-16-hour-eyeshadow?productId=VP10281","None","New Carlisle , ohio",5,"Loved it"
"http://www.ulta.com/colorstay-16-hour-eyeshadow?productId=VP10281","Dorrie","Independence, mo",5,"I bought it because many shadows are frosty and they don't look good on &quot;mature women.&quot;"
"http://www.ulta.com/colorstay-16-hour-eyeshadow?productId=VP10281","Princess","Houston, TX",2,"This quad is not as bright on the skin as it looks in the palette. I was very disappointed."
"http://www.ulta.com/colorstay-16-hour-eyeshadow?productId=VP10281","Sophia","San Diego, CA",5,"Such a great product. The colors are so easy to apply and it lasts forever. I wear the neutral quad to work at it still looks fabulous after a 7 1/2 sweaty shift at my restaurant!"
"http://www.ulta.com/colorstay-16-hour-eyeshadow?productId=VP10281","Lynn Oliver","Lexington, MO",5,"Very nice colors."
"http://www.ulta.com/colorstay-16-hour-eyeshadow?productId=VP10281","Lynn Oliver","Lexington, MO",5,"Nice Colors."
"http://www.ulta.com/colorstay-16-hour-eyeshadow?productId=VP10281","J","Chicago",4,"Make pigments longer lasting. Good for the price and I use the dark color as a liner."
"http://www.ulta.com/colorstay-16-hour-eyeshadow?productId=VP10281","lenny","plano tx",2,"the case is not easy to open product does not last is ok just not what I expected"
"http://www.ulta.com/colorstay-16-hour-eyeshadow?productId=VP10281","suziepr","West Bloomfield, MI",4,"Good value"
"http://www.ulta.com/colorstay-16-hour-eyeshadow?productId=VP10281","abs' mom","Medford Oregon",5,"I have been trying to find an eyeshadow that stays in place and doesn't crease.  This one is good at staying and lasting throughout the day"
"http://www.ulta.com/colorstay-16-hour-eyeshadow?productId=VP10281","Fading away","Fairfax, VA",3,"This product has a new packaging look, but it seems like it doesn't stay on as long as the old did."
"http://www.ulta.com/colorstay-16-hour-eyeshadow?productId=VP10281","nanni","indiana",5,"These eyeshadows is so great. I have seductive and inspired and the colors are beautiful and lasted all day. Would definitely buy again."
"http://www.ulta.com/colorstay-16-hour-eyeshadow?productId=VP10281","willworkformakeup","US",2,"The positives are that the color comes off well onto the brush, the colors are absolutely beautiful and it has a lovely silky texture. However, in my experience this shadow was not easy to blend without either becoming uneven in distribution on the eyelid or without wiping off the other color from the quad that was previously applied. All of the colors tend to fade or otherwise come off the lid quite easily, even when using a high quality primer. I wanted to like this product but I was ultimately dissapointed. However, with an improvement in the formulation, I think this shadow could be a winner."
"http://www.ulta.com/colorstay-16-hour-eyeshadow?productId=VP10281","Bodeila","Mpls, MN",4,"I have been testing the eye shadow in the 90 degree heat and it holds up well! The quad is small enough to toss in my purse for touch-ups, if needed.  Love it!"
"http://www.ulta.com/colorstay-16-hour-eyeshadow?productId=VP10281","Grumpy Gal","Myrtle Beach, SC",1,"Ok, I used to LOVE the colorstay eyeshadows, but these are a load of nasty.  I seriously bought blushed wines in the old formula about nine times because I kept using it up, and sandstorm was amazing for neutrals... but these... oh my goodness, just save your money.  I bought addictive and precocious because I thought between the two I could make up for blushed wines.  NO.  AWFUL. It's just a glittery mess.  What the heck is with the white and silver colors?  They don't do anything but leave a bunch of glitter on your face.  Not just your eyes.  Your entire face.  I have great brushes.  Tried to apply this three different times, and every time wound up with a too-dark glittery mess.  Waste of money.  And no, it's not my application that's bad-- I'm a trained makeup artist, I know how to apply makeup and believe me I tried to not make this a waste of money.  But that's all this was.  UGH."
"http://www.ulta.com/colorstay-16-hour-eyeshadow?productId=VP10281","hearttaker72","Delaware, Ohio",5,"Amazing product. Plan to use it everyday"
"http://www.ulta.com/colorstay-16-hour-eyeshadow?productId=VP10281","countrylane","wichita falls, tx",4,"I use this eye shadow for daily use.  I like the color combinations, it's easy to apply and it lasts throughout the day."
"http://www.ulta.com/colorstay-16-hour-eyeshadow?productId=VP10281","cher the hair doer","New York mills ,New York",5,"I used it on a Prom girl it was great to apply,and lasted all nite"
"http://www.ulta.com/colorstay-16-hour-eyeshadow?productId=VP10281","Gabybear","Miami,fl",3,"Bought it only for the teal shade. Works great with a base underneath... Great for spring"
"http://www.ulta.com/colorstay-16-hour-eyeshadow?productId=VP10281","lipstickcrazy","Metro east illinois",4,"This is my third quad from the 16 hour collection.  I use a cream shadow as a primer and these shadows blend easily and last all day without creasing. If I don't use a primer the colors are less intense and last several hours. I love the convenience of only having to use one quad to create a quick look for work. I bought 'sun swept'for the soft teal, 'goddess' for the pink and 'decadent' for a deeper neutral look. Each quad has a highlight and crease color too that coordinates so I don't have to fuss. The are some satiny shimmers but not too much for my mature eyes."
"http://www.ulta.com/colorstay-16-hour-eyeshadow?productId=VP10281","Taryn908","Maine",4,"I find that by the end of the day it is all worn off even though it claims to be 16 hour."
"http://www.ulta.com/colorstay-16-hour-eyeshadow?productId=VP10281","Winterstyle","Chicago, IL",4,"Perfect combination of colors. I use it every day."
"http://www.ulta.com/colorstay-16-hour-eyeshadow?productId=VP10281","Nacole","California",3,"The product is not horrible by any means.  I do love the colors but the shadows take about three layers to get a decent pigmentation.  It is good enough to where I will keep the shadows and continue using them, but I'm not too sure if I am going to buy any other colors."
"http://www.ulta.com/colorstay-16-hour-eyeshadow?productId=VP10281","Hot Momma","Rayne, La",5,"I have always used makeup brushes to apply eye shadow but recommend using the sponge applicator it comes with instead because it works much better. I' have the Adventurous palette and I love it. It looks good with jeans during the day while shopping, good when I wear it with dresses for special occasions and if I layer it, it looks sexy for going going out on a date. You can control how much you apply to make it look natural or layer it as I said for a more dramatic look. I love a more expensive brand but it runs at $20 per color for eye shadow and this is the only brand I've found that lasts all day and doesn't crease at all."
"http://www.ulta.com/colorstay-16-hour-eyeshadow?productId=VP10281","Lexi","Chicago",3,"I got this in Decadent as a cheap, versatile eyeshadow I could throw in my purse. It looked pretty and was versatile enough, but every time I wore it, it faded within a couple of hours! Even the brown shade was almost invisible by lunchtime, and all that was left was glitter. Considering it's marketed as a long wearing shadow, I was disappointed."
"http://www.ulta.com/colorstay-16-hour-eyeshadow?productId=VP10281","Jen the RedHead","Chicago",2,"I have the shade &quot;Goddess&quot;. When it arrived, the colors weren't true to the photo here, but that's the risk I take with online shopping. When I went to apply it, the shadow had almost no pigmentation at all- even the darkest color was just a sheer dusting. I applied a few layers hoping to build up the color, but all it resulted in was a bunch of dusty fallout on my cheeks and in my eyes. Ouchie. I wouldn't recommend this to any of my friends or colleagues, but I did recommend it to a coworker whose 13 year old daughter is just starting to get into makeup. My coworker is worried about her daughter over-doing it, so I figured she would be safe with this palette. I hear the other shade options can be more pigmented... Maybe I just got a dud!"
"http://www.ulta.com/colorstay-16-hour-eyeshadow?productId=VP10281","PamT","Louisville,KY",5,"Little sparkly for daytime, but great for evening.  Love the color palet"
"http://www.ulta.com/colorstay-16-hour-eyeshadow?productId=VP10281","foster","new orleans",1,"i tried and tried to like these eyeshadows i applied with the applicator a brush and it just does not want to go on my eye. I used a paint pot before i applied and it just didnt work for me. the colors are very pretty but like i said it just did not want to go on my eye. :-( i just want to find a good eye shadow"
"http://www.ulta.com/colorstay-16-hour-eyeshadow?productId=VP10281","tmiller","San Francisco, CA",4,"I have the &quot;Brazen&quot; color set and love it!  It's a little flaky, but I usually apply it over a cream shadow so it sticks pretty well.  The color stays nicely throughout the day and it's easy to layer to make amore dramatic look."
"http://www.ulta.com/colorstay-16-hour-eyeshadow?productId=VP10281","Me","Cleveland, Oh",4,"For the price, the quality was better than expected."
"http://www.ulta.com/colorstay-16-hour-eyeshadow?productId=VP10281","shasta","Dallas Texas",5,"for evening use"
"http://www.ulta.com/colorstay-16-hour-eyeshadow?productId=VP10281","CiaoBella","Chicago, IL",4,"Goes on well, evenly and color wears well over the day."
"http://www.ulta.com/colorstay-16-hour-eyeshadow?productId=VP10281","anniek","Chicago, IL",4,"Decently constructed applicator (w/out buying brushes)<br />Multi-colored for multiple outfits"
"http://www.ulta.com/colorstay-16-hour-eyeshadow?productId=VP10281","k251","Louisiana",4,"good colors for a natural look. Needed eye shadow for everyday and this is perfect!"
"http://www.ulta.com/colorstay-16-hour-eyeshadow?productId=VP10281","Inner City Kitty","Atlanta, GA",1,"I didn't like this at all.  It would not apply well, even with just one color, then I tried to add the dark color on the crease of the eye, and it looked like I had just gotten in a fight.  It wouldn't mix, or spread on the eyelid."
"http://www.ulta.com/colorstay-16-hour-eyeshadow?productId=VP10281","Dedee","Miami, Florida",3,"It isn't bad but nothing to brag about !"
"http://www.ulta.com/colorstay-16-hour-eyeshadow?productId=VP10281","IndyMischa","Indianapolis, IN",2,"This eyeshadow goes on pretty close to non-existent and then what little color you do get, wears off within a few hours. I only gave two stars vs one because there's low fallout (my biggest pet peeve with eyeshadow). Definitely do not recommend."
"http://www.ulta.com/colorstay-16-hour-eyeshadow?productId=VP10281","Sherry","Charleston, Wv",1,"The color was too dark"
"http://www.ulta.com/colorstay-16-hour-eyeshadow?productId=VP10281","Lsheath1","Lubbock, TX",5,"I wear makeup every day, but do not like overly sparkly/ super frosted shadow. I have had a hard time finding a subtle color suitable for everyday wear. Most other shadow sets have a very shiny highlight color that seems too much for me."
