"url","name","location","rating","review"
"http://www.ulta.com/colorstay-16-hour-eyeshadow?productId=VP10281","maris","Lubbock, Texas",5,"Also the employee that was checking my items out was very rude. She was to busy looking around the store and not paying attention to the person in front of them. It took her a minute to focus on me to see what I attempting to tell her about the birthday gift. Very disappointed in the customer service there. I love the store and the products it offers but Ulta needs to work on their employees customer service."
"http://www.ulta.com/colorstay-16-hour-eyeshadow?productId=VP10281","BARB","FRANKLIN, WI",5,"use for work"
"http://www.ulta.com/colorstay-16-hour-eyeshadow?productId=VP10281","Candy cane","Reading , PA",5,"I love it"
"http://www.ulta.com/colorstay-16-hour-eyeshadow?productId=VP10281","n/a","suburban Chicago",4,"good color combinations--lasts well"
"http://www.ulta.com/colorstay-16-hour-eyeshadow?productId=VP10281","Srqcarol","Sarasota, Florida",5,"Okay"
"http://www.ulta.com/colorstay-16-hour-eyeshadow?productId=VP10281","Mitch the Nurse","West Fargo,N. Dak.",5,"Goes on very easily- stays on- I like it does not crease. Other shadows I have tried, creased -smudged-and did not stay on-it is a all day&amp;night shadow love it!!"
"http://www.ulta.com/colorstay-16-hour-eyeshadow?productId=VP10281","Kat","Lawrenceville",4,"I purchased this because I could not find my color in a competitors line.  Too bad for old line I like this better"
"http://www.ulta.com/colorstay-16-hour-eyeshadow?productId=VP10281","ambrosiamy","Henderson, NV",5,"For once I can say I really really like this product!"
"http://www.ulta.com/colorstay-16-hour-eyeshadow?productId=VP10281","Betty","Atlanta, ga.",4,"I wish there were more product  of each color."
"http://www.ulta.com/colorstay-16-hour-eyeshadow?productId=VP10281","Nancygirl","Glen Allen, Virginia",4,"Good value for the price. Will keep using. Wish there was more of the lid color and less of the accent colors."
"http://www.ulta.com/colorstay-16-hour-eyeshadow?productId=VP10281","Itza","Dallas",5,"Love it!"
"http://www.ulta.com/colorstay-16-hour-eyeshadow?productId=VP10281","Classy Chick","Las Vegas, NV",4,"So sexy! Perfect for date night."
"http://www.ulta.com/colorstay-16-hour-eyeshadow?productId=VP10281","BKL","Arkansas",4,"Actually, only the yellow color in this quad is glittery.  The others are just fine. As I am older, the glitter just doesn't work for me, but it is pretty."
"http://www.ulta.com/colorstay-16-hour-eyeshadow?productId=VP10281","nan","chicago",4,"Great price, last's all day...Blend's well.  Will buy this again."
"http://www.ulta.com/colorstay-16-hour-eyeshadow?productId=VP10281","MNM17","Raleigh, NC",5,"I have 3 of these quads and love the color payoff. Plus they are super blendable. I have attitude, delightful and decadent."
"http://www.ulta.com/colorstay-16-hour-eyeshadow?productId=VP10281","BKL","Arkansas",5,"These colors are easily adapted to dramatic or natural looks."
"http://www.ulta.com/colorstay-16-hour-eyeshadow?productId=VP10281","BKL","Arkansas",5,"Easy to apply, wonderful color."
"http://www.ulta.com/colorstay-16-hour-eyeshadow?productId=VP10281","Kath","Seattle, WA",1,"I miss the original ColorStay Eyeshadow Quad by Revlon --&gt; Bring it back!!  :("
"http://www.ulta.com/colorstay-16-hour-eyeshadow?productId=VP10281","Rosemary","Chicago",4,"The shelf had a picture suggesting how to apply these colors. I did it as it said and the result was amazing!"
"http://www.ulta.com/colorstay-16-hour-eyeshadow?productId=VP10281","k","high point, nc",5,"use everyday<br />great palette from light to dark shades that are good for any skin color"
"http://www.ulta.com/colorstay-16-hour-eyeshadow?productId=VP10281","Grandma Barbara","Louisville, KY",5,"Use it for everyday"
"http://www.ulta.com/colorstay-16-hour-eyeshadow?productId=VP10281","Bubbles","Ramsey, NJ",4,"You can achieve a whole range of looks with this eyeshadow quad, from sedate to striking. I like the way the colors blend. The two purple shadows are fairly intense, especially the darker one."
"http://www.ulta.com/colorstay-16-hour-eyeshadow?productId=VP10281","tinter53","carnegie Pa",4,"I bought it because of a coupon. Didn't expect to love it!"
"http://www.ulta.com/colorstay-16-hour-eyeshadow?productId=VP10281","Robin!","Houma, LA",4,"i was pleasantly surprised when i used this product for the first time. beautiful color and blends very well."
"http://www.ulta.com/colorstay-16-hour-eyeshadow?productId=VP10281","Laura","Green brook, nj",1,"Doesn't last"
"http://www.ulta.com/colorstay-16-hour-eyeshadow?productId=VP10281","Laytens mommie","Thib La",5,"Been using this for years, wont switch to any other :)"
"http://www.ulta.com/colorstay-16-hour-eyeshadow?productId=VP10281","taxinjazz","Det, Michigan",4,"I had been eyeing the quad Inspired for some time. The description says this eyeshadow is safe for contact lens wearers but it has glitter in them. After applying the shadows, there was glitter under my eyes.  For someone that wears contact lens, this is something I try to stay away from. Other than that, I love this quad. Wish it didn't have glitter."
"http://www.ulta.com/colorstay-16-hour-eyeshadow?productId=VP10281","Krystal the silly Mommy","Spring Texas",4,"I use this product everyday."
"http://www.ulta.com/colorstay-16-hour-eyeshadow?productId=VP10281","MissM","Stockton, CA",3,"Great selection of colors, great price but make sure you use a primer because it creases terribly."
"http://www.ulta.com/colorstay-16-hour-eyeshadow?productId=VP10281","Carolyn","St. Louis, MO",5,"Looks so smooth and natural and doesn't have too much sparkle. I would call these colors illumination for your eyes because it makes your lids glow. This blend of purples is also great for fair skin and night time looks without looking too heavy. An easy-to-use smokey look in one compact!"
"http://www.ulta.com/colorstay-16-hour-eyeshadow?productId=VP10281","Carolyn","St. Louis, MO",5,"Would absolutely recommend this eyeshadow compact. If you are a person who thinks that every eyeshadow you get is too sparkly and not enough illumination, this compact is for you. It looks natural and flawless and makes your eyes pop without people thinking you just stepped out of a 1980's dance party. I've had 6 people in the last 3 days comment on my eyes. Thank you Revlon! You nailed it!"
"http://www.ulta.com/colorstay-16-hour-eyeshadow?productId=VP10281","susie","Hammond, La.",5,"Good old reliable...great price and love the results. Better than most of the pricey stuff.... I have stopped shopping the expensive eyeshadows and reurned to Revlon"
"http://www.ulta.com/colorstay-16-hour-eyeshadow?productId=VP10281","Mary, RN","Jacksonville, FL",4,"Affordable and just a great product!"
"http://www.ulta.com/colorstay-16-hour-eyeshadow?productId=VP10281","Keisha Peacha","Miami, FL",4,"I love it. It applies smoothly and easily and it shows! Long lasting."
"http://www.ulta.com/colorstay-16-hour-eyeshadow?productId=VP10281","Red","Chicago, IL",5,"I don't wear much makeup but when I do I like it to look natural. This eye shadow does the job."
"http://www.ulta.com/colorstay-16-hour-eyeshadow?productId=VP10281","MSE","Maryland",5,"Color is true and blends beautifully. Stayed on all day and looked as fresh in the p.m. as it did when first applied in the a.m. Works better than the more expensive brands."
"http://www.ulta.com/colorstay-16-hour-eyeshadow?productId=VP10281","akiss","Scottsdale, AZ",5,"Love all Revlon products it is a trusted name in the beauty industry."
"http://www.ulta.com/colorstay-16-hour-eyeshadow?productId=VP10281","tonimc","Austin, TX",4,"These shadows last longer than most, but do still fade some.  My only complaint is you have to buy an entire set of 4-colors and cannot buy them individually.  Consequently I use two and the other two are a waste."
"http://www.ulta.com/colorstay-16-hour-eyeshadow?productId=VP10281","Toya","Killeen, TX",4,"I like this product"
"http://www.ulta.com/colorstay-16-hour-eyeshadow?productId=VP10281","Miss E","Lubbock, TX",3,"I really like the easy application of this product. I think the colors are fantastic. They aren't too dull nor are they too bright."
"http://www.ulta.com/colorstay-16-hour-eyeshadow?productId=VP10281","MakeupJunkie","San Jose, CA",4,"I use these eyeshadows almost everyday!  The quality is great, except for the fact that the packaging is really cheap.  The little flap thingy broke off within 2 weeks of my purchase.  The product is great but the packaging is bottom line bad."
"http://www.ulta.com/colorstay-16-hour-eyeshadow?productId=VP10281","Sunshine","Nampa, ID",4,"I was looking for colors that would bring out my hazel eyes and this product was great!  It enhanced my eyes."
"http://www.ulta.com/colorstay-16-hour-eyeshadow?productId=VP10281","Kenz","Idaho",5,"Although the colors I got weren't the ones in the picture, I am very happy with the eyeshadow. It is easy to take the colors from a more simple day look to a deeper night look."
"http://www.ulta.com/colorstay-16-hour-eyeshadow?productId=VP10281","La","Lincoln, CA",5,"Love this eyeshadow - goes on smooth and stays on all day!"
"http://www.ulta.com/colorstay-16-hour-eyeshadow?productId=VP10281","janieg","Norwalk",5,"Always use Revlon eyeshadow. Every other one seems to fade during the day. This stays on all day &amp; into the night. Love the colors."
"http://www.ulta.com/colorstay-16-hour-eyeshadow?productId=VP10281","Heather","North Carolina",5,"I love this stuff! I have been using it for years and I keep repurchasing it because it's a wonderful look. When I work I like to have a natural/neutral look going on and this is perfect (the brown quad). <br /><br />I pair it with NYX brown eyeliner and some black mascara and I'm good to go. :-)"
"http://www.ulta.com/colorstay-16-hour-eyeshadow?productId=VP10281","Christine","The Woodlands,TX",4,"It is pretty , but a bit too sparkly and the 4 colors are so similar they look the same on my eyelids ."
"http://www.ulta.com/colorstay-16-hour-eyeshadow?productId=VP10281","CubbyBear","San Jose, CA",4,"I think Revlon did themselves proud with the newer color combinations.  I think some are remakes of the old quads but most are new.  The colors stay on for a good 8-9 hours."
"http://www.ulta.com/colorstay-16-hour-eyeshadow?productId=VP10281","Working Mother of 3","Westerville, OH",5,"Great color, lasts all day without creasing or smudging.  The applicator could be better, makes application blotchy, but I just use my finger to apply and blend."
"http://www.ulta.com/colorstay-16-hour-eyeshadow?productId=VP10281","kpsbrie","Columbia, MD",5,"Suggest wetting applicator with a couple drops of water to prolong color for even longer"
"http://www.ulta.com/colorstay-16-hour-eyeshadow?productId=VP10281","Barb the sun lover","Phoenix, AZ",2,"I was told at the store that this eyeshadow stayed put once applied, and that was not the case.  I had it rub off on my upper lids and it looked bad."
"http://www.ulta.com/colorstay-16-hour-eyeshadow?productId=VP10281","Barbara K.","Wichita, KS",4,"I read about this in Allure magazine and I love trying new colors. I bought the blue palette, which works great day or not depending on how you apply it. It's a great cheaper alternative, but it's not my favorite brand."
"http://www.ulta.com/colorstay-16-hour-eyeshadow?productId=VP10281","Kaye","Greensboro, NC",5,"This product is great...I was looking for a great khaki green color and a brown without any red, and this product had both..."
"http://www.ulta.com/colorstay-16-hour-eyeshadow?productId=VP10281","MO Shopping","St. Louis",4,"I had given up on using eye shadow - mostly because I was tired of the creases and the settling into my &quot;smile lines&quot;. This cream shadow goes on smoothly and stays that way. I chose neutral colors since I have blue eyes and it gives me just the right amount of highglights"
"http://www.ulta.com/colorstay-16-hour-eyeshadow?productId=VP10281","Shrieking Violet","WY",1,"While the color selection is great, this shadow lasts roughly 20 minutes.  It needs primer to stay put, and will leak even then, as it needs to be layered on like cement.  It wears off if you even think about physical activity.  Don't bother with this product."
"http://www.ulta.com/colorstay-16-hour-eyeshadow?productId=VP10281","the nurse","texas",1,"yuck"
"http://www.ulta.com/colorstay-16-hour-eyeshadow?productId=VP10281","Clio","East Texas",4,"I purchased 550 enchanted. All of the colors are nice and apply well. For those with oily skin, it may be to your advantage to use a primer because there is a bit of creasing."
"http://www.ulta.com/colorstay-16-hour-eyeshadow?productId=VP10281","Cat","Las Vegas,NV",5,"I've been using this for quite some time and if I want to have a more dramatic look I can apply the darker of the shades."
"http://www.ulta.com/colorstay-16-hour-eyeshadow?productId=VP10281","None","Tulsa, OK",4,"Pretty much said it all above."
"http://www.ulta.com/colorstay-16-hour-eyeshadow?productId=VP10281","Natalie, CNM","Atlanta, GA",5,"Easily applied. great price, does not crease!"
"http://www.ulta.com/colorstay-16-hour-eyeshadow?productId=VP10281","Mimi","West Chester, PA",5,"Just love it.....have worn it for years!!"
"http://www.ulta.com/colorstay-16-hour-eyeshadow?productId=VP10281","mary lou","texas",4,"I like the eyeshadow.  A good value."
"http://www.ulta.com/colorstay-16-hour-eyeshadow?productId=VP10281","Christy","Chicago, IL",5,"Use it for everyday and special events."
"http://www.ulta.com/colorstay-16-hour-eyeshadow?productId=VP10281","Rollerqueen","Los Angeles, CA",5,"I use the darkest color to fill in my eyebrows and combine the rest for many looks including a smoky eye look.  I love the warmer tones so of course the coffee bean is perfect for me. When used with a good primer these colors can last!"
"http://www.ulta.com/colorstay-16-hour-eyeshadow?productId=VP10281","Samsters","St. Louis, MO",4,"I really like this product! I own it in &quot;asure mist&quot;, which consists of a whitish-blue, a light blue, a medium blue, and a black. my favorite part was how well the colors created a complete look! all the colors had a subtle blue undertone that made the look overall very cohesive. you can use just the whitish-blue, light blue, and medium blue for a fun look that you can wear everyday or going out, or incorporate the black for a smokey look. My only problem with this quad is that that shadows don't last that long, and the light colors tend to fade. other than that, pretty good!"
"http://www.ulta.com/colorstay-16-hour-eyeshadow?productId=VP10281","Sarah","Dallas, TX",4,"This is by far one of my favorite eye shadow products.  I've bought various colors from various brands, and this is the only one I keep coming back to.  I love the way this blends so nicely and naturally onto my eyes.  It can easily become more dramatic by using darker shades, but I mostly use it for day to day activities.  An amazing product!"
"http://www.ulta.com/colorstay-16-hour-eyeshadow?productId=VP10281","86mizztoot[@]","atlanta, ga",3,"wet and wild deadly sins quads are better.. check those out ladies"
"http://www.ulta.com/colorstay-16-hour-eyeshadow?productId=VP10281","Klove","Portland or",2,"Was pretty disappointed because I love revlon but this product didn't cut it for me."
"http://www.ulta.com/colorstay-16-hour-eyeshadow?productId=VP10281","w","Fort Worth, TX",4,"Great product at a great price!"
"http://www.ulta.com/colorstay-16-hour-eyeshadow?productId=VP10281","FASHIONESTA DAWN","DES PLAINES, ILLINOIS",5,"I love these Revlon Eye Shadows,Love the Colors,been using them for years, and what a great buy at Ulta...WOW"
"http://www.ulta.com/colorstay-16-hour-eyeshadow?productId=VP10281","FASHIONESTA DAWN","DES PLAINES, ILLINOIS",5,"I love these Revlon Eye Shadows,Love the Colors,been using them for years, and what a great buy at Ulta...WOW"
"http://www.ulta.com/colorstay-16-hour-eyeshadow?productId=VP10281","Sue","Breese, Illinois",5,"I love this product I wear it to work"
"http://www.ulta.com/colorstay-16-hour-eyeshadow?productId=VP10281","lbelle","Charleston, IL",5,"It is a great product. Ulta is an amazing store."
"http://www.ulta.com/colorstay-16-hour-eyeshadow?productId=VP10281","kpsbrie","Columbia, MD",4,"Wet the applicator and apply shadow for an even longer lasting color."
"http://www.ulta.com/colorstay-16-hour-eyeshadow?productId=VP10281","Hannah","Chicago, IL",5,"STAYS vibrant all day! I always come back to this eye shadow.  The colors are vibrant and blend very well into each other, and you can make it look as natural or as dramatic as you want.  Love it!"
"http://www.ulta.com/colorstay-16-hour-eyeshadow?productId=VP10281","Nurse Candy","Jacksonville, FL",5,"So many of compact eyeshadows have colors that don't accent each other; this one is perfect."
"http://www.ulta.com/colorstay-16-hour-eyeshadow?productId=VP10281","Krystle","Florida",5,"I used this pallet for many occasions like school or going out. There are several colors to choose from depending on which pallet you pick. I got the smokey and coffee bean quad. Great colors and they last a long time :)"
"http://www.ulta.com/colorstay-16-hour-eyeshadow?productId=VP10281","Purple Pickle","Charlotte, NC",5,"This is the only eyeshadow that I will wear.  I have droopy eyelids and this eyeshadow doesn't make lines in the creases during the day.  It does last all day and stays looking fresh."
"http://www.ulta.com/colorstay-16-hour-eyeshadow?productId=VP10281","Kiki","Georgia",5,"This is my favorite eye shadow. It stays on all day and I like the different greys. You can use it for both day and night by making it darker with the black."
"http://www.ulta.com/colorstay-16-hour-eyeshadow?productId=VP10281","Marion","Tacoma, WA",4,"stays on well"
"http://www.ulta.com/colorstay-16-hour-eyeshadow?productId=VP10281","DebR","Fort Worth",3,"I needed a gray eyeshadow but didn't want to spend a lot of money and this fit the bill. It goes on well and stays fairly long. It worked for what I needed."
"http://www.ulta.com/colorstay-16-hour-eyeshadow?productId=VP10281","Wenndy","Santa Ana",4,"Love this product, not only is it affordable, but it is also nice :)!!!"
"http://www.ulta.com/colorstay-16-hour-eyeshadow?productId=VP10281","SalukiD","Southern Illinois",4,"This is a great product at an affordable price."
"http://www.ulta.com/colorstay-16-hour-eyeshadow?productId=VP10281","Destini","Fairfield",5,"I love this combination.  The colors go with just about anything!"
"http://www.ulta.com/colorstay-16-hour-eyeshadow?productId=VP10281","Jessesthetician","Indiana",2,"Product is easy to use.<br />Pigment is not the best<br />Good price"
"http://www.ulta.com/colorstay-16-hour-eyeshadow?productId=VP10281","Julie","Sarasota Fl. and Newark Ohio",5,"The color was what I was looking for."
"http://www.ulta.com/colorstay-16-hour-eyeshadow?productId=VP10281","Sunshine","Marked Tree, ar",4,"Easy to apply and stays on all day"
"http://www.ulta.com/colorstay-16-hour-eyeshadow?productId=VP10281","Wineluver","Sacramento, CA",5,"Looked perfect 12 hours later...Highly recommend and great price!"
"http://www.ulta.com/colorstay-16-hour-eyeshadow?productId=VP10281","Lola Murrie","Baton Rouge, LA",1,"I have pretty fair skin, and the stupid eye shadow didn't even show up on my skin! I used it with and without a base, but it didn't matter. It just sucked. This was definitely a waste of money."
"http://www.ulta.com/colorstay-16-hour-eyeshadow?productId=VP10281","Ej","Middletown PA",5,"This shadow provides great long lasting coverage for a reasonable price. I've been using this shadow for yrs nothing beats it"
"http://www.ulta.com/colorstay-16-hour-eyeshadow?productId=VP10281","Kaiulani607","Los Angeles, CA",5,"I have this quad in Sandstorm and I love it!  I wear it to work and it lasts all day."
"http://www.ulta.com/colorstay-16-hour-eyeshadow?productId=VP10281","Anissa","Los Angeles, CA",5,"I've been using this shadow for -years- and it's great for just about everything. The colour set I use, Blushed Wines, perfectly complements my green eyes...and the lightest shade in that set doubles as a brow and cheek highlighter. It's very pigmented, doesn't smudge, and blends like a dream...great product!"
"http://www.ulta.com/colorstay-16-hour-eyeshadow?productId=VP10281","Shell","Prattville, AL",5,"I wear it everyday. I do not leave my house without makeup.  I know, I am a freak~ but I can't subject the world to my ugliness!"
"http://www.ulta.com/colorstay-16-hour-eyeshadow?productId=VP10281","Shirley","Oklahoma city",5,"I love it"
"http://www.ulta.com/colorstay-16-hour-eyeshadow?productId=VP10281","Bookworm306","Catasauqua, PA",5,"I love these nude colors, they look great with my blue eyes."
"http://www.ulta.com/colorstay-16-hour-eyeshadow?productId=VP10281","sonnie the dreamer","st. paul, MN",4,"i love this product.......some colors don't show up like how it looks in the revlon model pictures.......but it is beautiful.....definitely a product that i would be buying again"
"http://www.ulta.com/colorstay-16-hour-eyeshadow?productId=VP10281","Jo B","Washington, DC",5,"I picked the compact with 4 different tones in it - and I loved it!"
"http://www.ulta.com/colorstay-16-hour-eyeshadow?productId=VP10281","Erica","Rch Cucamonga, CA",5,"I did a all blue look and loved the pigment of product and color was perfect."
"http://www.ulta.com/colorstay-16-hour-eyeshadow?productId=VP10281","Shannon","Rockford Il",4,"The colors are perfect for natural looks."
"http://www.ulta.com/colorstay-16-hour-eyeshadow?productId=VP10281","Livermagoo","Littleton, CO",5,"I bought this palette strictly for the mauve color but found I loved all 4 colors.  They work very well together.  It blends great.  The dark color stays on as a liner too."
"http://www.ulta.com/colorstay-16-hour-eyeshadow?productId=VP10281","DeviousLady","Pendleton, NY &amp; Ft Myers, FL",5,"No comments."
"http://www.ulta.com/colorstay-16-hour-eyeshadow?productId=VP10281","Smilinsouthernbella","Cullman, AL",5,"I love these colors. I have very clear blue eyes and red hair. This pallet has been a go to for me for some time. I line with Eggplant, Blue or sometime Green. All work well together. I can play up the pink tone or I can gold it up more and it works well with cool or warm lipsticks and blush."
"http://www.ulta.com/colorstay-16-hour-eyeshadow?productId=VP10281","MC","Hartselle, AL",5,"Very natural looking"
"http://www.ulta.com/colorstay-16-hour-eyeshadow?productId=VP10281","Carazy","San Jose",4,"Didn't have time to get to the Clinique counter so bought this as I was leaving town. I loved the colors and got several compliments on my eyes."
"http://www.ulta.com/colorstay-16-hour-eyeshadow?productId=VP10281","Srtfulrose","Florida",5,"This is a good product that lasts all day. My favorite eye shadow"
"http://www.ulta.com/colorstay-16-hour-eyeshadow?productId=VP10281","Jules0723","Chicago",5,"This product made my blue eyes really pop!"
"http://www.ulta.com/colorstay-16-hour-eyeshadow?productId=VP10281","Rosie","San Antonio, Texas",5,"I like Revlon products."
"http://www.ulta.com/colorstay-16-hour-eyeshadow?productId=VP10281","becca","oklahoma city",5,"n/a"
"http://www.ulta.com/colorstay-16-hour-eyeshadow?productId=VP10281","Mom of 2","Birmingham, AL",5,"I've been using this eyeshadow for years and I still love it."
"http://www.ulta.com/colorstay-16-hour-eyeshadow?productId=VP10281","Christie D","La Jolla, CA",4,"My only problem with this eyeshadow is that I use up all of the base color way before the rest of the colors.  I would love it if Revlon would sell the base colors separately (or make it a larger section), so that I don't have to buy a whole new quad every time I run out of my favorite base color. (which is the gold in Neutral Khakis)."
"http://www.ulta.com/colorstay-16-hour-eyeshadow?productId=VP10281","kino3637","Sugar Land, Tx",5,"I tend to finish the lightest shade first.  I have no complaints.  It is my choice product."
"http://www.ulta.com/colorstay-16-hour-eyeshadow?productId=VP10281","Eros","Newport News, VA",1,"Just not impressed. The color wasn't very vibrant and it did not last 12 hours on me before wearing off"
"http://www.ulta.com/colorstay-16-hour-eyeshadow?productId=VP10281","jrhayashi","Fremont, CA",4,"I use this a couple of times of week. i have blue eyes and fair skin so it goes well"
"http://www.ulta.com/colorstay-16-hour-eyeshadow?productId=VP10281","exdredy","Milford, MI",3,"I really thought colors were more defined especially since I am very fair skinned."
"http://www.ulta.com/colorstay-16-hour-eyeshadow?productId=VP10281","RGD","Greenville, SC",4,"I like the subtle glimmer.  It makes it special without being flashy."
"http://www.ulta.com/colorstay-16-hour-eyeshadow?productId=VP10281","beachgirl","Boca Raton, FL",5,"I was pleasantly surprised by how easily and smoothly the shadows went on. The colors in the quad were excellent!! olive, plum, neutrals."
"http://www.ulta.com/colorstay-16-hour-eyeshadow?productId=VP10281","annabanana","plano, Tx",5,"love the color! Compares to dept brand eyeshadows."
"http://www.ulta.com/colorstay-16-hour-eyeshadow?productId=VP10281","jenskaiz","mesa, az",5,"easy..."
"http://www.ulta.com/colorstay-16-hour-eyeshadow?productId=VP10281","Ange","VA",5,"Makes my blue eyes &quot;pop&quot;"
"http://www.ulta.com/colorstay-16-hour-eyeshadow?productId=VP10281","Shopper2011","Appleton, WI",3,"Test it before you buy it to makej sure it is the shade you want."
"http://www.ulta.com/colorstay-16-hour-eyeshadow?productId=VP10281","rdmlr","upland,ca",5,"like it"
"http://www.ulta.com/colorstay-16-hour-eyeshadow?productId=VP10281","Sherbear","Phoenix, AZ",4,"Great for everyday use &amp; also for more dramatic/evening use."
"http://www.ulta.com/colorstay-16-hour-eyeshadow?productId=VP10281","melissas","lansing, mi",5,"love the eyeshadow"
