"url","name","location","rating","review"
"http://www.ulta.com/colorstay-ultimate-suede-lipstick?productId=xlsImpprod4950065","wildflower","Fullerton, Ca",1,"I bought 2 ... Love the colors, love the names, hate the lipstick! It doesn't go on smoothly. It's dry, then tacky. I tried putting it on with a gloss or Chapstick over it, but then the color comes off! So unhappy ..."
"http://www.ulta.com/colorstay-ultimate-suede-lipstick?productId=xlsImpprod4950065","Frankieo","Sterling CT",4,"This product stays on for a frw hours and leaves a slight stain.  Best I have found"
"http://www.ulta.com/colorstay-ultimate-suede-lipstick?productId=xlsImpprod4950065","Martini Fridays","Chicago, IL",5,"Love it!  It works great for cheer competitions"
"http://www.ulta.com/colorstay-ultimate-suede-lipstick?productId=xlsImpprod4950065","Adriana","las vegas",5,"This is really nice!!!!"
"http://www.ulta.com/colorstay-ultimate-suede-lipstick?productId=xlsImpprod4950065","Tracy","VA",3,"I was looking for a long wearing lipstick and tried this. It's drying, so I felt the need to wear chapstuck with it. It also came off easily in parts of my lips and then looked clumpy in the other parts."
"http://www.ulta.com/colorstay-ultimate-suede-lipstick?productId=xlsImpprod4950065","Holly","North Port, Fl",4,"Good product"
"http://www.ulta.com/colorstay-ultimate-suede-lipstick?productId=xlsImpprod4950065","Shawn's Queen B","Orlando",4,"I am not a big fan of lipstick but love this. Stays on, looks great, easy to apply evenly. I got it in several colors and love them all."
"http://www.ulta.com/colorstay-ultimate-suede-lipstick?productId=xlsImpprod4950065","Joy","Hollister, MO",5,"I like a natural lip as an older woman."
"http://www.ulta.com/colorstay-ultimate-suede-lipstick?productId=xlsImpprod4950065","Deb","Florida",5,"Excellent product"
"http://www.ulta.com/colorstay-ultimate-suede-lipstick?productId=xlsImpprod4950065","Mac","Antioch ca",5,"I just love it!!!!"
"http://www.ulta.com/colorstay-ultimate-suede-lipstick?productId=xlsImpprod4950065","Jessie","Wisconsin",3,"It has a nice color and smooth application, but it does not wear well through meals. It lasts up to 4 hours. If you do not eat, it lasts longer."
"http://www.ulta.com/colorstay-ultimate-suede-lipstick?productId=xlsImpprod4950065","Ari","Los Angeles, CA",5,"Love the colours in the collection, good price for good colour. Very longlasting...just that it's really sticky."
"http://www.ulta.com/colorstay-ultimate-suede-lipstick?productId=xlsImpprod4950065","N/A","Chatsworth, CA",1,"The lipstick does not stay on smooth."
"http://www.ulta.com/colorstay-ultimate-suede-lipstick?productId=xlsImpprod4950065","Kel","Akron, oh",5,"Great product! Long lasting, will even stay on overnight!"
"http://www.ulta.com/colorstay-ultimate-suede-lipstick?productId=xlsImpprod4950065","Preet","Memphis,TN",5,"I got this bcoz of its natural color nd sale too..though I wasn't sure if it will look good on me or not but it complimented my skin color so much nd its matte nd long lasting..I already recommended it to some of my friends"
"http://www.ulta.com/colorstay-ultimate-suede-lipstick?productId=xlsImpprod4950065","Youthmom","Atlanta",5,"I use this lipstick every day for all occasions"
"http://www.ulta.com/colorstay-ultimate-suede-lipstick?productId=xlsImpprod4950065","Kristine","Pewaukee, WI",4,"Would buy again.  This lipstick lasted long which is hard to find."
"http://www.ulta.com/colorstay-ultimate-suede-lipstick?productId=xlsImpprod4950065","Tweety","Illinois",5,"Been using this lipstick for a long time.  Really love the reds"
"http://www.ulta.com/colorstay-ultimate-suede-lipstick?productId=xlsImpprod4950065","Vickie","Texas",5,"A very simple one  time application and it lasted all day."
"http://www.ulta.com/colorstay-ultimate-suede-lipstick?productId=xlsImpprod4950065","Ca","Savannah, GA",1,"Not long lasting at all. Horrible color."
"http://www.ulta.com/colorstay-ultimate-suede-lipstick?productId=xlsImpprod4950065","Phenominoduck","Lawrence, KS",3,"This is a great color but it is one which wears off very easily and then looks tacky."
"http://www.ulta.com/colorstay-ultimate-suede-lipstick?productId=xlsImpprod4950065","Juliebenar","Illinois",4,"This is my fourth one!"
"http://www.ulta.com/colorstay-ultimate-suede-lipstick?productId=xlsImpprod4950065","LAT","Tampa",2,"Probably won't use  it"
"http://www.ulta.com/colorstay-ultimate-suede-lipstick?productId=xlsImpprod4950065","Tg","Fl",4,"None"
"http://www.ulta.com/colorstay-ultimate-suede-lipstick?productId=xlsImpprod4950065","Ani","Wisconsin",2,"This product is not long lasting at all. Wears off very easily.. would go back to the regular liquid colorstay reckon lipstick"
"http://www.ulta.com/colorstay-ultimate-suede-lipstick?productId=xlsImpprod4950065","Pam","Washington",4,"Stays on nice color"
"http://www.ulta.com/colorstay-ultimate-suede-lipstick?productId=xlsImpprod4950065","HockeyGirl","Indiana",4,"Lipstick stays on, doesn't flake off throughout the day! It also isn't sticky or I have no need to reapply throughout the day, even after drinking something and lunch."
"http://www.ulta.com/colorstay-ultimate-suede-lipstick?productId=xlsImpprod4950065","dungeon repunzul","Highlands Ranch, CO",5,"See above"
"http://www.ulta.com/colorstay-ultimate-suede-lipstick?productId=xlsImpprod4950065","Sniper","Mpls, MN",1,"I tried this once, and it was not true to color. I will be returning it. They came out much brighter, and not the color I was looking for. The color is awful."
"http://www.ulta.com/colorstay-ultimate-suede-lipstick?productId=xlsImpprod4950065","Ty","Tennessee",5,"Great"
"http://www.ulta.com/colorstay-ultimate-suede-lipstick?productId=xlsImpprod4950065","Kathy","Bellevue",2,"It was sparkly, and it didn't apply evenly or stay on long."
"http://www.ulta.com/colorstay-ultimate-suede-lipstick?productId=xlsImpprod4950065","Lori Lynn","Buchanan, Michigan",5,"I like the color but if was a little sticky"
"http://www.ulta.com/colorstay-ultimate-suede-lipstick?productId=xlsImpprod4950065","Rachel","New Jersey",4,"I have a few of these and they feel and wear well. They don't dry out my lips and it stays on for a few hours."
"http://www.ulta.com/colorstay-ultimate-suede-lipstick?productId=xlsImpprod4950065","Jax","Boise, ID",4,"Fun color for summer!"
"http://www.ulta.com/colorstay-ultimate-suede-lipstick?productId=xlsImpprod4950065","Retired lady","North Georgia",4,"I like that the lipstick lasts all day.  I don't want to spend time refreshing.  I wish it were a little glossier."
"http://www.ulta.com/colorstay-ultimate-suede-lipstick?productId=xlsImpprod4950065","Pkg","Fl",1,"Felt like wax on my lips.  Returned it."
"http://www.ulta.com/colorstay-ultimate-suede-lipstick?productId=xlsImpprod4950065","1taximom23","Arlington, TX",4,"Bought this for my daughter, who is just learning, and it works well. Small enough container that it works well for her hand size, but gives her enough  to work with and not look garish."
"http://www.ulta.com/colorstay-ultimate-suede-lipstick?productId=xlsImpprod4950065","Slyvonne","Coastal FL",4,"All long last lipsticks are drying , but this one is the least drying I,ve found .I prefer to use a lip liner first because of my age. I use this every day and have repurchased it many times when it,s used up .Colors from natural to bright , whatever your mood !"
"http://www.ulta.com/colorstay-ultimate-suede-lipstick?productId=xlsImpprod4950065","Barb","Paso Robles",5,"I use it by itself as well as with a gloss from Bare Minerals.  My husband who never notices my makeup even commented on my lip color that he liked it."
"http://www.ulta.com/colorstay-ultimate-suede-lipstick?productId=xlsImpprod4950065","Vicky","Los Angeles",4,"I bought this lipstick first time. Like it. Long lasting, but needs moisturizer."
"http://www.ulta.com/colorstay-ultimate-suede-lipstick?productId=xlsImpprod4950065","Auburn Lights","Chapel Hill, TN",5,"Mix two colors.  Love this lipstick.  Can depend on it staying on all day when I put it on in the morning."
"http://www.ulta.com/colorstay-ultimate-suede-lipstick?productId=xlsImpprod4950065","Auburn Lights","Chapel Hill, TN",5,"Love the that this stays on all day with very little  or no touch-up needed."
"http://www.ulta.com/colorstay-ultimate-suede-lipstick?productId=xlsImpprod4950065","Sue","Florida",4,"This lipstick gives my lips a natural looking color boost and it lasts all day!"
"http://www.ulta.com/colorstay-ultimate-suede-lipstick?productId=xlsImpprod4950065","KL","Grand Rapids MI",5,"I have used this lipstick for the past few years. I have not gotten anything else because when you found something that works, why change?! I love it and it lasts all day! There are many nice colors to choose from!"
"http://www.ulta.com/colorstay-ultimate-suede-lipstick?productId=xlsImpprod4950065","Robin","Bowleys Quarters MD",3,"It leaves your lips dry."
"http://www.ulta.com/colorstay-ultimate-suede-lipstick?productId=xlsImpprod4950065","Em","Whittier,Alaska",4,"This lipstick is true to the color, It matches well with everything mostly since its Red, this color makes me feel more confident as well, This lipstick is also long-lasting and many people have complimented that it goes well with my skin tone(Fair toned)."
"http://www.ulta.com/colorstay-ultimate-suede-lipstick?productId=xlsImpprod4950065","CityFolk","Chicago, IL",3,"This lipstick is kind of 'meh', The color looks nice, it goes on really quick and easy, and it stays well. However it's extremely sticky which I found a little distracting during the day: not enough to throw it out, but enough that I won't wear it if I'm going to be busy or chatty at work."
"http://www.ulta.com/colorstay-ultimate-suede-lipstick?productId=xlsImpprod4950065","Debbie","Wilmington nc",5,"Great product"
"http://www.ulta.com/colorstay-ultimate-suede-lipstick?productId=xlsImpprod4950065","ek","US",1,"I put it on, let it set, and took a sip of coffee. It transferred all over the lid and was completely gone after I finished my coffee. I got a dark color, which usually has staying power"
"http://www.ulta.com/colorstay-ultimate-suede-lipstick?productId=xlsImpprod4950065","the skier","glen mills [a",2,"I prefer a brighter color.  The color is not the same as in the tube."
"http://www.ulta.com/colorstay-ultimate-suede-lipstick?productId=xlsImpprod4950065","Sandra","Florence sc",1,"It wasn't true to color and was clumpy"
"http://www.ulta.com/colorstay-ultimate-suede-lipstick?productId=xlsImpprod4950065","annazay","Berkley",3,"The color is good."
"http://www.ulta.com/colorstay-ultimate-suede-lipstick?productId=xlsImpprod4950065","LC","boston, ma",4,"."
"http://www.ulta.com/colorstay-ultimate-suede-lipstick?productId=xlsImpprod4950065","Mimi","Washington, DC",3,"While this lipstick had great color payoff, it was really sticky and dried out quicker than most other lipsticks I use"
"http://www.ulta.com/colorstay-ultimate-suede-lipstick?productId=xlsImpprod4950065","patricia","Boston MA",2,"Disappointed in quality &amp; color accuracy."
"http://www.ulta.com/colorstay-ultimate-suede-lipstick?productId=xlsImpprod4950065","Sadie","FL",5,"Everyday use.  NOTHING else prevents feathering like this product.  Beautiful colors and lasts better than anything else I have ever used."
"http://www.ulta.com/colorstay-ultimate-suede-lipstick?productId=xlsImpprod4950065","Nettie","illinois",1,"Too dull not at all like it looks would not recommend"
"http://www.ulta.com/colorstay-ultimate-suede-lipstick?productId=xlsImpprod4950065","Rob","Mt Pleasant",4,"I like all-day lipsticks. I usually use the ones with an applicator and they work the best, but they can be clumpy and look like a residue on your mouth. I was pleasantly surprised that I like this a lot."
"http://www.ulta.com/colorstay-ultimate-suede-lipstick?productId=xlsImpprod4950065","meme lynn","Springhill,  Tn",5,"NA"
"http://www.ulta.com/colorstay-ultimate-suede-lipstick?productId=xlsImpprod4950065","M.","Illinois",5,"Could be a little moister"
"http://www.ulta.com/colorstay-ultimate-suede-lipstick?productId=xlsImpprod4950065","Grandmother","Maryland",5,"I like the product."
"http://www.ulta.com/colorstay-ultimate-suede-lipstick?productId=xlsImpprod4950065","the Fez","Salem,OR",1,"very dry going on, and just doesn't look good."
"http://www.ulta.com/colorstay-ultimate-suede-lipstick?productId=xlsImpprod4950065","DGonz","Alexandria, VA",5,"I wear several shades of this:  Trendsetter, Finale, Supermodel, Wardrobe.  I am a red lip wearer every day for work and I can apply it in the morning and it last about 6-8 hours a day, with a minor matte gloss touch up.  It easily removes at the end of the day with petroleum jelly and wiped off.  I snack all day at work on fruit and salads and it lasts through apple eating.   The price point is a great value considering how long it lasts all day.  The color doesn't dry out either.  If I make a mistake in application I use a dry Qtip and clean up the lines immediately before the color sets.   It isn't a gloss finish and more of a matte set."
"http://www.ulta.com/colorstay-ultimate-suede-lipstick?productId=xlsImpprod4950065","Poopysmom","Meridian ID",5,"All day coverage with a minimum of touch up............love it!"
"http://www.ulta.com/colorstay-ultimate-suede-lipstick?productId=xlsImpprod4950065","Em","Palmdale ca",5,"Great product! Such a pretty color:)"
"http://www.ulta.com/colorstay-ultimate-suede-lipstick?productId=xlsImpprod4950065","GBPKRFN","Missoula, MT",5,"My only complaint is that when it gets to the end, due to the design, it seems like there is still a lot of product that you can only access by digging into it!"
"http://www.ulta.com/colorstay-ultimate-suede-lipstick?productId=xlsImpprod4950065","peggy","Fort Gratiot",5,"i have not wore make-up in many years and am trying to get back to using a little and I needed a lighter shade.  Now what do I do with this lipstick?"
"http://www.ulta.com/colorstay-ultimate-suede-lipstick?productId=xlsImpprod4950065","Fancypantsanj","Portland",1,"This was way too dry and tacky feeling"
"http://www.ulta.com/colorstay-ultimate-suede-lipstick?productId=xlsImpprod4950065","Shanna","Tennessee",2,"The range of color offered with this product is awesome. I tried the shade Socialite and absolutely LOVE the color. It certainly lives up to its name, it lasts a very long time. However, the formula is very thick, causing it to be very sticky. Even with a lip primer, I noticed it beginning to clump within minutes of application."
"http://www.ulta.com/colorstay-ultimate-suede-lipstick?productId=xlsImpprod4950065","Sexy Grandma","Phenix Vity, Alabam",4,"The great thing is, that it's slim, fits in any purse and has a tight top."
"http://www.ulta.com/colorstay-ultimate-suede-lipstick?productId=xlsImpprod4950065","Pumpkin sweetie","New york",5,"Everyday"
"http://www.ulta.com/colorstay-ultimate-suede-lipstick?productId=xlsImpprod4950065","Newbe","Bolingbrook, IL",5,"I stumble across this brand and so happy I did. Love the application and it last through breakfast"
"http://www.ulta.com/colorstay-ultimate-suede-lipstick?productId=xlsImpprod4950065","Ali","Redlands",1,"would not buy again"
"http://www.ulta.com/colorstay-ultimate-suede-lipstick?productId=xlsImpprod4950065","donna","mt",3,"not enough color"
"http://www.ulta.com/colorstay-ultimate-suede-lipstick?productId=xlsImpprod4950065","Keywest67","Beavercreek, OH",4,"Love this lipstick, lasts longer than most others I've tried."
"http://www.ulta.com/colorstay-ultimate-suede-lipstick?productId=xlsImpprod4950065","east coast girl","McLean, VA",2,"Product is very dry.  Even with lip balm under or over this lipstick it is still too dry."
"http://www.ulta.com/colorstay-ultimate-suede-lipstick?productId=xlsImpprod4950065","Desi","San Diego",5,"It is a great product and color stays on for hours"
"http://www.ulta.com/colorstay-ultimate-suede-lipstick?productId=xlsImpprod4950065","marter","north ga",5,"Really like will buy again what more can I say"
"http://www.ulta.com/colorstay-ultimate-suede-lipstick?productId=xlsImpprod4950065","ViStar","Chattanooga, TN",1,"I bought this product from my local drug store and I was realy excited to try it. It went on really smooth but not 3 minutes later my lips felt so dry and sticky. I can't stand having anything sticky on my lips so it really bugged me. I tried to put a moistuizing balm on under the lipstick next time I applied it and the color went on very splotchy and was uneven."
"http://www.ulta.com/colorstay-ultimate-suede-lipstick?productId=xlsImpprod4950065","abcD","Rockford IL",3,"The color is long lasting this I like but drys out my lips"
"http://www.ulta.com/colorstay-ultimate-suede-lipstick?productId=xlsImpprod4950065","Sooner Girl","Amarillo, TX",3,"This lipstick was smooth and moisturizing, but I had to apply it 2-3 times to get any depth of color.  I would recommend using it more as a moisturizer (with a touch of color) during the day."
"http://www.ulta.com/colorstay-ultimate-suede-lipstick?productId=xlsImpprod4950065","fashiongirl","irmo,sc",1,"I wanted to like this product but I found it very drying and am going to return it."
"http://www.ulta.com/colorstay-ultimate-suede-lipstick?productId=xlsImpprod4950065","Nims","Naples, Fl",5,"Great day use lipstick in this color. Wonderful long-wearing even if you eat at your desk. May need a little touch-up after eating but not much!<br />The stay closed cap is a must for my purse, where things eventually end up at the bottom and bumped by big wallet."
"http://www.ulta.com/colorstay-ultimate-suede-lipstick?productId=xlsImpprod4950065","Angela","New Richmond, WI",4,"This lipstick goes on creamy and smooth.  The color is accurate to the tube, and lasts for hours.  I was very happy with this lipstick, and believe me, I have a bag full of others I don't use.  This is a great product and value."
"http://www.ulta.com/colorstay-ultimate-suede-lipstick?productId=xlsImpprod4950065","PAW","Houston, TX",3,"if you have problems wearing &quot;all-day&quot; wear lip color, you'll experience the same difficulty with this product. My lips got so chapped, I developed cold sores so I had to return it."
"http://www.ulta.com/colorstay-ultimate-suede-lipstick?productId=xlsImpprod4950065","Lu","Melbourne, FL",2,"Went on nicely, but very drying."
"http://www.ulta.com/colorstay-ultimate-suede-lipstick?productId=xlsImpprod4950065","Dog","Shelby, MI",1,"Not very impressed with the product."
"http://www.ulta.com/colorstay-ultimate-suede-lipstick?productId=xlsImpprod4950065","Jen from Den","Denver, CO",1,"The color was too pink for me although I like a soft rose color lipstick. Even though I have bought Color Stay lipstick in the past and had no issues, this one was dry and just wasn't right. I returned it."
"http://www.ulta.com/colorstay-ultimate-suede-lipstick?productId=xlsImpprod4950065","Buffy","panama city beach, fl",4,"color is vibrant and has long lasting wear"
"http://www.ulta.com/colorstay-ultimate-suede-lipstick?productId=xlsImpprod4950065","Gayle113","collierville tn",1,"does not go on smooth, clummy, beads up on lips"
"http://www.ulta.com/colorstay-ultimate-suede-lipstick?productId=xlsImpprod4950065","Thanda","Eunice, LA",5,"Love it!, Color Pops but not too much!"
"http://www.ulta.com/colorstay-ultimate-suede-lipstick?productId=xlsImpprod4950065","Thanda","Eunice, LA",5,"Does not feather, stays on wonderfully!"
"http://www.ulta.com/colorstay-ultimate-suede-lipstick?productId=xlsImpprod4950065","Sarah","OKC",4,"I really like this lipstick. It is drying if you dont put gloss over the application. It does last all day and does not smear or clump."
"http://www.ulta.com/colorstay-ultimate-suede-lipstick?productId=xlsImpprod4950065","Maun","Berlin  NJ",1,"Read about this product in a magazine for color to last on your lips.  However, I found it very drying on the lips."
"http://www.ulta.com/colorstay-ultimate-suede-lipstick?productId=xlsImpprod4950065","Grace","Port St Lucie, FL",5,"goes on so easy, and stays on almost all day.."
"http://www.ulta.com/colorstay-ultimate-suede-lipstick?productId=xlsImpprod4950065","Sexykitty406","Stillwater ok",3,"Not a fan but it's feels so drying other than that I would like it"
"http://www.ulta.com/colorstay-ultimate-suede-lipstick?productId=xlsImpprod4950065","CelesteAD","Cleveland, OH",5,"I love this lipstick! It nearly has the staying power of a stain but doesn't dry out your lips. Color selection is great, too. Highly recommended."
"http://www.ulta.com/colorstay-ultimate-suede-lipstick?productId=xlsImpprod4950065","Oregon girl","Lafayette, Tn",3,"Goes on smoothly but not very long lasting."
"http://www.ulta.com/colorstay-ultimate-suede-lipstick?productId=xlsImpprod4950065","SHARON MCCANLIES","ARLINGTON, TEXAS76010THIS",2,"This shade of pink loved the color, but, not on <br />me.  It was to bright."
"http://www.ulta.com/colorstay-ultimate-suede-lipstick?productId=xlsImpprod4950065","Laiza","Manteca",5,"Best lipstick I've ever owned and thats saying alot"
"http://www.ulta.com/colorstay-ultimate-suede-lipstick?productId=xlsImpprod4950065","paulad","chapel hill, NC",4,"loved it"
"http://www.ulta.com/colorstay-ultimate-suede-lipstick?productId=xlsImpprod4950065","Someone who normally just uses lip gloss","Fort Worth TX",5,"Looks good on the rim of a wine glass."
"http://www.ulta.com/colorstay-ultimate-suede-lipstick?productId=xlsImpprod4950065","LisaAnn","Whitewater, California",5,"I'm on my 2nd tube of this lipstick!  I love how smoothly it applies, and the color stays nicely.  I use color 045."
"http://www.ulta.com/colorstay-ultimate-suede-lipstick?productId=xlsImpprod4950065","Cristi","Tulsa, OK",4,"Really like how this goes on, good coverage.  Just let it dry and then apply a gloss, does dry your lips a bit but nothing like its competitors."
"http://www.ulta.com/colorstay-ultimate-suede-lipstick?productId=xlsImpprod4950065","Former Flight Attendant","Pittsburgh",1,"I've tried two different colors, and both dry within 2 minutes after applying to a finish that is anything but moist.  Lips feel dry and look dry.  I've tried appying butters and ointments afterwords,only to see the color fade within a few hours.  Will not waste my money.  Very disappointed in Revlon--I've bought Revlon lipsticks for 20+ years.  Time to switch."
"http://www.ulta.com/colorstay-ultimate-suede-lipstick?productId=xlsImpprod4950065","magpie","pasadena, ca",2,"I loved the color and matte finish but it tends to get clumpy and dry on my lips after a few minutes of wear."
"http://www.ulta.com/colorstay-ultimate-suede-lipstick?productId=xlsImpprod4950065","Barb","Dallas, TX",2,"Initially it went on well and looked good but after an hour or two the gloss disappeared and the lipstick had become slightly dry and cracked looking."
"http://www.ulta.com/colorstay-ultimate-suede-lipstick?productId=xlsImpprod4950065","Sandy","Denver, CO",5,"I've never before found a lipstick that stays on even after eating and that is not too dramatic or washes out my complexion. My ideal shade gives me a natural color yet doesn't look tacky and this is it. I got 'finale' because I like the cherry red undertone. It's much lighter and sheerer than it appears but that's what I prefer for a natural look. I exfoliated and put on lip balm before application. It did apply unevenly but I evened it out with my finger. I'm so glad it met my biggest desires; actually lasts after lots of use and gives a natural, flattering color! I'm glad I tried it even with the negative reviews."
"http://www.ulta.com/colorstay-ultimate-suede-lipstick?productId=xlsImpprod4950065","Makeup Girl","Ny",3,"I really loved the color and the color last along time."
"http://www.ulta.com/colorstay-ultimate-suede-lipstick?productId=xlsImpprod4950065","Casual reviewer","Stockton, CA",2,"The formula is rather good for its long lasting wear, but it's a bit drying and I didn't really care for the shimmer (shade 055 iconic). I think it's best to make sure your lips have been properly conditioned before application of this lipstick to prevent over-drying. <br /><br />I liked the color and wear for shade 085 trendsetter, it's a good bright red with no unnecessary sparkles. I wouldln't wear it every day, but for a special dinner I think it would be appropriate."
"http://www.ulta.com/colorstay-ultimate-suede-lipstick?productId=xlsImpprod4950065","summer","san jose, ca",1,"Not true to color. Terrible"
"http://www.ulta.com/colorstay-ultimate-suede-lipstick?productId=xlsImpprod4950065","Katie p","Atlanta, Georgia",3,"This lipstick is decent but this color is not as saturated as others of the same brand... its a little sheer and doesn't seem to last as long as some of the other colors"
"http://www.ulta.com/colorstay-ultimate-suede-lipstick?productId=xlsImpprod4950065","jcb","Wilmington, NC",4,"Very true color that only fades a little after several hours.  But feels very dry after only 30 minutes at most."
"http://www.ulta.com/colorstay-ultimate-suede-lipstick?productId=xlsImpprod4950065","Kay","Bellingham wa",1,"I did not old this product it got clumpy after applying it, maybe mine was just a bad one but I did not like it"
"http://www.ulta.com/colorstay-ultimate-suede-lipstick?productId=xlsImpprod4950065","for the birds","florida",5,"applies easy. doesn't dry out lips. wears well."
"http://www.ulta.com/colorstay-ultimate-suede-lipstick?productId=xlsImpprod4950065","kathyginop","orchard park, ny",2,"Beautiful color that did not last.  When it wore off it was uneven and very clumpy looking.  Would not suggest."
"http://www.ulta.com/colorstay-ultimate-suede-lipstick?productId=xlsImpprod4950065","Lulu","Knoxville, TN",2,"I was not super impressed with this product. Though it did stay pretty well, it was pretty drying to my lips and the color I picked looked kind of peachy or more neutral but when applied was very pink."
