"url","name","location","rating","review"
"http://www.ulta.com/colorstay-concealer?productId=xlsImpprod4960009","Stella Jean","Weslaco, Texas",4,"I use this concealer to cover my imperfections and I use it to highlight under my eyes. I love it but it gives a slight sting every time I apply."
"http://www.ulta.com/colorstay-concealer?productId=xlsImpprod4960009","DM","Atlanta, Ga",1,"I absolutely love the colorstay foundation and have used it for years so I figured I'd like this concealer! Absolutely hated it. Worst concealer I've ever used. Once I blended it, it literally disappeared. No coverage and no color stayed on whatsoever once blended."
"http://www.ulta.com/colorstay-concealer?productId=xlsImpprod4960009","Rachel makeup addict","Kentucky",1,"Made my pores HUGE! Never seen a product do such a thing before. I guess it settled in my pores."
"http://www.ulta.com/colorstay-concealer?productId=xlsImpprod4960009","Olivia Begnel","O'Fallon, Missouri",5,"This concealer has to be one of the best concealers i have ever had(&amp;Ive had A LOT). I have extremely dark  circles, and this completely cover everything!! There colors have more of a yellow tone, but the fairest color isn't too yellow."
"http://www.ulta.com/colorstay-concealer?productId=xlsImpprod4960009","La Patrona","San Antonio Texas",5,"I loved it. It's the Percocet coverage "
"http://www.ulta.com/colorstay-concealer?productId=xlsImpprod4960009","Lila","Prue, OK",5,"I like how it goes on and is easily blended with makeup."
"http://www.ulta.com/colorstay-concealer?productId=xlsImpprod4960009","KileyB","Phoenix AZ",1,"didn't cover well at all and I'm a big fan of of the coverstay."
"http://www.ulta.com/colorstay-concealer?productId=xlsImpprod4960009","Lisa","long beach",3,"Other than a beauty blender I couldn't find the right brush to blend it with and came out a little blotchy with my fingers that's the annoying part because then it creases<br />But with a beauty blender and setting it it works greats"
"http://www.ulta.com/colorstay-concealer?productId=xlsImpprod4960009","Cass","Fort Collins, CO",4,"Covers what little under eye circles I have and a few spots pretty well."
"http://www.ulta.com/colorstay-concealer?productId=xlsImpprod4960009","Skylarmakeupartistry","South Carolina",2,"This is not the best product at all! I've tried many times to like this product but I just can't seem to like it. It doesn't last all day. It's creases even after it is set. It settles into fine lines. There's just nothing good about this concealer."
"http://www.ulta.com/colorstay-concealer?productId=xlsImpprod4960009","Tina","Las vegas",5,"I liked it"
"http://www.ulta.com/colorstay-concealer?productId=xlsImpprod4960009","naz","chicago, il",4,"This concealer was not that long lasting, since it has a sheer light formula that is not thick, it will crease if you apply too much under your eyes, BUT it  is perfect for highlighing the bridge of your nose, and highlighting your face and it will look gorgeous once set with a long lasting loose poweder! I give it a 8/10 since it is not long lasting, BUT it can be if you do add powder on top."
"http://www.ulta.com/colorstay-concealer?productId=xlsImpprod4960009","Abi:)","Rome",4,"I love this concealer! Covers my dark circles very easily and stays on for as long as I need it too and I don't even have to set it with powder. It also works as an eyeshadow primer. The only thing I don't like about it is it doesn't cover acne very well and will come off quickly on pimples."
"http://www.ulta.com/colorstay-concealer?productId=xlsImpprod4960009","Phoebe","Milwaukee, wi",1,"Not 24 hour coverage... Doesn't even stay on for 10 minutes after applying it. It wipes right off. It's too liquidy for anything besides under the eye concealer."
"http://www.ulta.com/colorstay-concealer?productId=xlsImpprod4960009","Susan","Spartanburg SC",4,"I have fair skin and asked the customer service associate her opinion. She suggested one shade darker. Better to go 2 shades. One shade darker covers but is noticeable"
"http://www.ulta.com/colorstay-concealer?productId=xlsImpprod4960009","jazzibear","wi",5,"i use it to high light the forehead,under eyes,down the center of the nose....don't need to spend more.very good product"
"http://www.ulta.com/colorstay-concealer?productId=xlsImpprod4960009","Tanya","Fort Drum, NY",1,"I bought this as an under eye concealer.  It did seem to cover well when applied. I didn't like that it felt like it never dried and the moistness from it caused my mascara to transfer during the day.  This would probably work for someone who sets concealer with a powder.  I have another concealer that does better and dries to a satin finish so this just went in the trash."
"http://www.ulta.com/colorstay-concealer?productId=xlsImpprod4960009","nnnniicole","san diego, ca",3,"-blends well<br />-a lighter coverage<br />-yellow undertone <br />-good for highlighting <br />-lightweight"
"http://www.ulta.com/colorstay-concealer?productId=xlsImpprod4960009","Miss Kelly Renee","Los Angeles",3,"When I get this concealer in the right color, it blends just fine. I have no issues with it.<br />However, I accidentally got one that was too light for me and decided to repurpose it for a highlight shade. However, it looks super cakey and it feels heavy as well as makes my skin tingle. Granted, that tinglyness goes away but yeah, it sure doesn't feel great.<br />I don't think I will buy this again, but I don't hate it."
"http://www.ulta.com/colorstay-concealer?productId=xlsImpprod4960009","Robyn","Central Virginia",1,"This is fine as an under-eye concealer. The problem is that is is very moist or oily or something, and after only a couple of hours I end up with big smudges of mascara under my eyes.  This doesn't happen with the other concealers I use. Maybe if you wore water-proof mascara, it would be OK."
"http://www.ulta.com/colorstay-concealer?productId=xlsImpprod4960009","Annette55","Port Huron, MI",4,"I use mostly for under eye circles. It works a swell as any other concealer that I've used. It has a a convenient sponge applicator, although my personal preference is a brush. Up close you can see that it settles in creases, but an overall better appearance than those dark purple circles!"
"http://www.ulta.com/colorstay-concealer?productId=xlsImpprod4960009","Tabatha","Charlotte, NC",1,"I usually love all the color stay products and this one was a miss...sorry I made the purchase"
"http://www.ulta.com/colorstay-concealer?productId=xlsImpprod4960009","ally","Yorkville IL",2,"I wanted to love this product, but I was horribly disappointed. I cannot keep it from creasing under my eyes. I've tried using primer, and setting it with powder but nothing works. However I have found myself using it for highlighting elsewhere (my nose, cheekbones, forehead, etc.) and it works well for that. If you're looking for a well rounded or under eye concealer, this is not for you."
"http://www.ulta.com/colorstay-concealer?productId=xlsImpprod4960009","Dancer","Orange Count, CA",5,"Very good product."
"http://www.ulta.com/colorstay-concealer?productId=xlsImpprod4960009","Miki","Dallas, TX",3,"It's easy to blend and apply. I mainly use it for my dark circle. But it doesn't cover well. Will not repurchase."
"http://www.ulta.com/colorstay-concealer?productId=xlsImpprod4960009","sf","Denver",4,"Very nice, smooth, easily blendable. Very nice product, but doesn't completely cover the dark circles under my eyes"
"http://www.ulta.com/colorstay-concealer?productId=xlsImpprod4960009","Dustie Rain","Andrews, TX",1,"I put it everywhere a concealer should go. Under my eyes, on my nose and forehead, and on my acne. I have to use SO MUCH product."
"http://www.ulta.com/colorstay-concealer?productId=xlsImpprod4960009","Do not have one.","Council bluffs ia.",4,"I have used it for a while."
"http://www.ulta.com/colorstay-concealer?productId=xlsImpprod4960009","JustaGirlWhoLikestoFeelPrettySometimes","Omaha, NE",5,"I tend to try different foundation/concealer combinations constantly because I have very oily skin and by the end of the day my face is melting off. I've tried everything from &quot;for oily skin&quot; to &quot;acne clearing&quot; to expensive &quot;clay&quot; foundations/concealers. Whether those are selling tactics or they flat out don't work, I have yet to find a concealer that does the job without caking or being too see through. I don't wear a lot of make up, but I do like to look complete. This concealer does that for me. It's a thicker, tackier, but VERY blend-able formula. It gives a full coverage look without being too heavy. I apply with a wet blender and it works great. No creasing or caking. I recommend giving this product a try. My Ulta is discontinuing certain colors so I hope that doesn't mean they're eliminating it completely. Hard to find inexpensive beauty products."
"http://www.ulta.com/colorstay-concealer?productId=xlsImpprod4960009","Mel","Denham springs la",4,"It's good"
"http://www.ulta.com/colorstay-concealer?productId=xlsImpprod4960009","Emma","Cleveland, OH",2,"Once you apply it over your foundation (which I used the Revlon Colorstay Foundation), it seems to work well at first. It blends well into the skin and the applicator was easy to work with. Then a couple hours later, it's like you never put it on. I put it under my eyes, the bridge of my nose, my chin, and on my forehead. All of that was gone and you could only see very obvious clumps around my nose, where my skin gets very dry. My skin was well moisturized and primed beforehand, and I even tried this concealer a couple more times. I tried baking with loose translucent powder, I tried setting it with pigmented press powder that matched my skin tone, and nothing worked. I would not recommend this if you have dry skin."
"http://www.ulta.com/colorstay-concealer?productId=xlsImpprod4960009","Ris","Canton OH",1,"This isn't a good cover up, I used it for under my eyes and it didn't cover. Poor coverage. Wouldn't get again."
"http://www.ulta.com/colorstay-concealer?productId=xlsImpprod4960009","Kylie","Ann Arbor",5,"It's the only concealer that truly matches my skin, similar to the color stay foundation. I like it for under eyes and concealing pimples."
"http://www.ulta.com/colorstay-concealer?productId=xlsImpprod4960009","MeganMarie","Dallas, TX",5,"I've been trying lots of concealers. I think so far this one is one of my favs for the price you get a good product."
"http://www.ulta.com/colorstay-concealer?productId=xlsImpprod4960009","MelMel","Chicago, IL",1,"Hmph. Thought this was going to be a great concealer based on other reviews but I found it completely unblendable.  Didn't hide anything and made my under eye area feel really dry.  I did return this product."
"http://www.ulta.com/colorstay-concealer?productId=xlsImpprod4960009","LT","Fort Wayne, IN",4,"I really like this concealer. The only issue that I had with it was that it wouldn't stay on over some blemishes but for the most part, it stayed on everywhere and blended great. I'm an athlete and it even stayed on during my games."
