"url","name","location","rating","review"
"http://www.ulta.com/perfect-touch-lighted-oval-mirror?productId=xlsImpprod3310043","DivaD","Tampa, Florida",1,"3 settings...dim, dimmer, dimmest. So disappointed. Hard to find a reasonably priced vanity mirror. It's going back."
"http://www.ulta.com/perfect-touch-lighted-oval-mirror?productId=xlsImpprod3310043","Deedee","houston",4,"I use this mirror daily!"
"http://www.ulta.com/perfect-touch-lighted-oval-mirror?productId=xlsImpprod3310043","Jane","St. Louis, MO",2,"Very nice, clean lines. Very convenient on the vanity. My one complaint, and it's a big one, it isn't bright enough. When doing makeup I like very bright, even lighting."
"http://www.ulta.com/perfect-touch-lighted-oval-mirror?productId=xlsImpprod3310043","Britney","Nederland tx",3,"I use this to do my makeup and hair."
"http://www.ulta.com/perfect-touch-lighted-oval-mirror?productId=xlsImpprod3310043","Lynnie","Westlake, Ohio",3,"I did not want to spend a fortune on a make up mirror. I received a really good one previously as a gift and when it was time to replace it, I was surprised at the cost. So I settled. This one would be okay if it had different light settings instead of low, medium and high. The touch settings on the base are too easy to accidentally hit and it's annoying."
"http://www.ulta.com/perfect-touch-lighted-oval-mirror?productId=xlsImpprod3310043","Priscilla","Houston TX",1,"Regular mirror light is very dim."
"http://www.ulta.com/perfect-touch-lighted-oval-mirror?productId=xlsImpprod3310043","rg","wilmington nc",5,"Purchased for my 75 yr old mother and she loves it."
"http://www.ulta.com/perfect-touch-lighted-oval-mirror?productId=xlsImpprod3310043","Webbie","Florida",2,"The mirror itself was fine but the light is too dim.  My bathroom lighting is not the best and the light on the mirror did not improve the situation."
"http://www.ulta.com/perfect-touch-lighted-oval-mirror?productId=xlsImpprod3310043","Cc","Lincoln RI",5,"Love this mirror"
"http://www.ulta.com/perfect-touch-lighted-oval-mirror?productId=xlsImpprod3310043","Jenn","Parma ohio",2,"The light was too dim and yellow on the highest setting. Returning"
"http://www.ulta.com/perfect-touch-lighted-oval-mirror?productId=xlsImpprod3310043","randeemtn","Georgia",1,"Even at the brightest setting it's a dim yellow tinged light that barely illuminates the face and barely shows up in the mirror. Will be returning."
"http://www.ulta.com/perfect-touch-lighted-oval-mirror?productId=xlsImpprod3310043","Wanda","Woodruff SC",3,"It was to short. I stand up to put makeup on. Will return and try something else."
"http://www.ulta.com/perfect-touch-lighted-oval-mirror?productId=xlsImpprod3310043","Linda","Gulf Breeze fl",1,"I couldn't use it no way to plug in at the store to review before purchase"
"http://www.ulta.com/perfect-touch-lighted-oval-mirror?productId=xlsImpprod3310043","Renie","Yorkville, IL",5,"Bought as a gift."
"http://www.ulta.com/perfect-touch-lighted-oval-mirror?productId=xlsImpprod3310043","Shawn's Queen B","Orlando",4,"This is a great mirror. I love the magnified side. Great for putting on makeup without my glasses."
