"url","name","location","rating","review"
"http://www.ulta.com/colorstay-ultimate-suede-lipstick?productId=xlsImpprod4950065","Jeanette","Destin, Florida",5,"When I saw all of the matte lipsticks at the Golden Globes, I immediately thought of this lipstick and decided to give it a try.  Its beautiful - I bought one tube about 2 weeks ago, and have gone back and bought 2 more since.  Supermodel and Runway are my favorites!  I love the finish - not too shiny (but not really matte until a bit later when its worn a little bit).  And my favorite quality about this lipstick is that it stays on through most of my morning and if I forget to reapply, my lips still carry a pretty stain of the color."
"http://www.ulta.com/colorstay-ultimate-suede-lipstick?productId=xlsImpprod4950065","Nancygirl","Glen Allen, Virginia",1,"Goes on nicely but within an hour lips feel dry. Have to add a top coat of lip balm to make your lips feel comfortable."
"http://www.ulta.com/colorstay-ultimate-suede-lipstick?productId=xlsImpprod4950065","Lisa","New Orleans, LA",4,"I am always looking for longer lasting lip color, and this is a better one.  It is still a little drying, but not nearly as much as other products offering long wear.  I let it dry, them apply a light gloss and it works for me."
"http://www.ulta.com/colorstay-ultimate-suede-lipstick?productId=xlsImpprod4950065","Linda","Houston, TX",1,"Not only does this lipstick not last, it even smeared at the mouth corners just from drinking water!  I removed it within an hour to use my regular brand."
"http://www.ulta.com/colorstay-ultimate-suede-lipstick?productId=xlsImpprod4950065","kathi","North Versailles, PA",1,"I did not like this product.  Was very disappointed."
"http://www.ulta.com/colorstay-ultimate-suede-lipstick?productId=xlsImpprod4950065","Kitty","Ohio",1,"I loved the color, but it hardly stays on for an hour"
"http://www.ulta.com/colorstay-ultimate-suede-lipstick?productId=xlsImpprod4950065","Pk","Strongsville, OH",4,"If you are looking for a moisturizing lipstick, this is definitely one to consider.  Nice application and pretty colors are a plus."
"http://www.ulta.com/colorstay-ultimate-suede-lipstick?productId=xlsImpprod4950065","kkoliv","texas",5,"soo good. lasted a reallly long time"
"http://www.ulta.com/colorstay-ultimate-suede-lipstick?productId=xlsImpprod4950065","lctiger","Columbia, MO",3,"Just doesn't stay put, but does leave a stain when wearing away.  Could be a little more full in color as I felt it was not sheer, but closer to sheer versus full color.  Definitely soft on lips."
"http://www.ulta.com/colorstay-ultimate-suede-lipstick?productId=xlsImpprod4950065","Sweetsz","Casa Grande, Az",2,"When you first apply it to your lips it's very moisturizing and shiny. But within a few minutes it becomes a matte the shine goes away it dries on your lips. For me it made my lips feel like chaped super dry and like maybe an hour later the color isnt as pigminted as when you first apply it."
"http://www.ulta.com/colorstay-ultimate-suede-lipstick?productId=xlsImpprod4950065","MaydlC","Cliffwood Beach, NJ",5,"This lipstick is absolutely wonderful!  It really does last as long as it claims, even longer!  I ate, drank, brushed my teeth, even slept with it on and it still looked like I had just applied it.  It doesn't make my lips dry like other long-lasting lipsticks.  It does feel slightly sticky, but it's the slightest sticky feeling.      <br /><br />I would wait a while before eating, drinking, etc. so that it can dry.  Also make sure that your lips are clean before applying.  This way you'll get the full long-lasting effects."
"http://www.ulta.com/colorstay-ultimate-suede-lipstick?productId=xlsImpprod4950065","Punchy","Santa Fe",4,"If I put this lipstick on in the morning, it is there when I clean my face at bedtime. Truly does last. Colors not exactly true---find that they are very &quot;plum/pink&quot; in tone. Lips don't feel dry, which is good, but you need to add shine if you want to see a glimmer."
"http://www.ulta.com/colorstay-ultimate-suede-lipstick?productId=xlsImpprod4950065","Allykatk","New Orleans, LA",1,"Did not like this at all!!"
"http://www.ulta.com/colorstay-ultimate-suede-lipstick?productId=xlsImpprod4950065","On the Go","Spanish Fort, AL",4,"I use this lipstick daily but I do have to put another lipstick on top to give the shine and moisturizing look."
"http://www.ulta.com/colorstay-ultimate-suede-lipstick?productId=xlsImpprod4950065","jojo","Naperville, Il",4,"Na"
"http://www.ulta.com/colorstay-ultimate-suede-lipstick?productId=xlsImpprod4950065","jojo","Naperville, Il",4,"Na"
"http://www.ulta.com/colorstay-ultimate-suede-lipstick?productId=xlsImpprod4950065","Kat","Weatherford tx",5,"None"
"http://www.ulta.com/colorstay-ultimate-suede-lipstick?productId=xlsImpprod4950065","myfu n33","tucson, az",1,"Terrible product with terrible quality."
"http://www.ulta.com/colorstay-ultimate-suede-lipstick?productId=xlsImpprod4950065","Misty","Longview, TX",2,"I ran out and bought this after seeing a couple of beauty blogger rave about it.  What a disappointment!  The color goes on splotchy and fades away quickly.  It also fades unevenly so you are left with a colored ring around your lips that looks like you used lip liner and forgot to put on any lipstick.  Won't buy another."
"http://www.ulta.com/colorstay-ultimate-suede-lipstick?productId=xlsImpprod4950065","Sarah","Hammond, LA",4,"This is a lovely color and the matte look is really nice. It lasts longer than normal lipstick but not as long as the combo longwear lipsticks."
"http://www.ulta.com/colorstay-ultimate-suede-lipstick?productId=xlsImpprod4950065","Arist","Lake Worth, Fl",3,"I loved the backstage color after seeing it in the ad on Olivia Wilde. It did not look the same on me at all though. On her it appears to be a deep blood red and when I apply it it's a purple red. Looks awful.<br />I didn't notice any extra softness to my lips either, seems like an average lipstick."
"http://www.ulta.com/colorstay-ultimate-suede-lipstick?productId=xlsImpprod4950065","Lily","Columbia, MO",4,"Like the natural look &amp; long lasting effect."
"http://www.ulta.com/colorstay-ultimate-suede-lipstick?productId=xlsImpprod4950065","Annette","Oxnard, Ca",4,"Love the color and it's long lasting.  However it does get dry and flakes somewhat.  I will purchase again because of the wonderful color."
"http://www.ulta.com/colorstay-ultimate-suede-lipstick?productId=xlsImpprod4950065","Bun","Westfield indiana",5,"I hope they never stop making this product!"
"http://www.ulta.com/colorstay-ultimate-suede-lipstick?productId=xlsImpprod4950065","Patty","Ebensburg, Pa",5,"I love this lipstick. Have been buying it for several years. Love the color selection and it is especially long lasting."
"http://www.ulta.com/colorstay-ultimate-suede-lipstick?productId=xlsImpprod4950065","me","boise",5,"Daily on the go"
"http://www.ulta.com/colorstay-ultimate-suede-lipstick?productId=xlsImpprod4950065","Ne","Louisiana",5,"Great"
"http://www.ulta.com/colorstay-ultimate-suede-lipstick?productId=xlsImpprod4950065","KcK","Illinois",5,"Great product"
"http://www.ulta.com/colorstay-ultimate-suede-lipstick?productId=xlsImpprod4950065","Deborah Edwards","Conway Arkansas",5,"Was amazing even after a full meal "
"http://www.ulta.com/colorstay-ultimate-suede-lipstick?productId=xlsImpprod4950065","none","Greenville NC",3,"This is a decent product  I am not in love with it but I don't hate it either<br />The lid snaps on a little tight/hard to open"
"http://www.ulta.com/colorstay-ultimate-suede-lipstick?productId=xlsImpprod4950065","Debbie","Austin, Texas",5,"Great color."
"http://www.ulta.com/colorstay-ultimate-suede-lipstick?productId=xlsImpprod4950065","Beauty Fiend","Rancho Cucamonga, CA",3,"I wasn't much of a &quot;lipstick all the time&quot; person. Lipstick can be high-maintenance, plus I have pale lips and like it, especially for my everyday look- which I prefer to be more natural. However I adore the subtle shades this new lipstick line offers, and absolutely love how easy, no-maintenance it is. It stays on virtually forever and never(I mean NEVER) smears.<br />However, it is dry. Not when you first apply it but shortly afterward. And it's more of a matte than a glossy finish, which personally I don't mind at all. Besides, I've found that a thin layer of clear chapstick or gloss will combat the dryness issue and add some shine.<br />So bottom line- I'd recommend this to a friend, depending on what they're looking for. If you want a bold, moisturizing, glossy-finish lipstick then no, this isn't for you. But if you don't mind either the dry/matte aspect or adding some gloss over top, and you want a long-lasting, doesn't budge, &quot;you mean I can wear lipstick without checking the mirror every 20 minutes to be sure it's still there and on the right part of my face&quot; lipstick then yes, you'll want this.<br /><br />Personally, it's made a &quot;lipstick-everyday&quot; girl out of me!"
"http://www.ulta.com/colorstay-ultimate-suede-lipstick?productId=xlsImpprod4950065","EyelinerQueen","Allentown, PA",1,"Ugh, this lipstick was so awful that I returned it! It was so drying and then it was so hard to remove and the color was NOT true to what it seemed! It reminded me of the lipstick my mom used to put on me when I was 5 years old and did ballet recitals. Not something I want to revisit."
"http://www.ulta.com/colorstay-ultimate-suede-lipstick?productId=xlsImpprod4950065","iamsterdam_68","Lubbock, TX",3,"Not as impressed by the color stay...gets very dry and makes my lips feel cracked.  Wish the shea butter worked as advertised.  Love the color, though!"
"http://www.ulta.com/colorstay-ultimate-suede-lipstick?productId=xlsImpprod4950065","Tumbleweed","Shreveport, La",4,"May have found a new favorite lipstick. This product definitely held up to a multi-hour challenge. So well that I actually had to wipe it off to apply more as it was getting a little dry looking. I love the matte finish. I did find that it will become very, very drying-especially if you reapply without removing the first layers. But other than that, I'm very, very pleased."
"http://www.ulta.com/colorstay-ultimate-suede-lipstick?productId=xlsImpprod4950065","Dee","Encinitas, CA",3,"I was very disappoimted that the color looked to be orange toned but turned pink on me."
"http://www.ulta.com/colorstay-ultimate-suede-lipstick?productId=xlsImpprod4950065","Carebear","Grand forks,nd",5,"I love this lip stick looks great stays on and truly moisturizes my lips."
"http://www.ulta.com/colorstay-ultimate-suede-lipstick?productId=xlsImpprod4950065","Tish","Toledo, OH",4,"Stays put"
"http://www.ulta.com/colorstay-ultimate-suede-lipstick?productId=xlsImpprod4950065","Classy Manager","Riverside, CA",5,"I like long lasting lipstick for daily use and this one is perfect.  This product Seriously lasts ALL DAY!  Doesn't dry out my lips and is easy to apply."
"http://www.ulta.com/colorstay-ultimate-suede-lipstick?productId=xlsImpprod4950065","CM-Fleur de Lis","Louisville, KY",4,"The color is true on as it presents itself in the container.  It is great going on and long-lasting.  However, after several hours, it did tend to make my lips a bit dry. This is a typical 'con' of most 'long-lasting products.'  All-in-all, I really like it."
"http://www.ulta.com/colorstay-ultimate-suede-lipstick?productId=xlsImpprod4950065","YesiP","Queens, NY",5,"I use it the product as it as a lipstick and its a great color and it lasts long. It's really pigmented and it goes on smooth."
"http://www.ulta.com/colorstay-ultimate-suede-lipstick?productId=xlsImpprod4950065","Poopysmom","Meridian ID",5,"I am known for my lipstick color and recommend it to anyone who asks. I have used this lipstick for about 2 years and now buy it 2 or 3 tubes at a time. Stays on all day with just minor touch ups."
"http://www.ulta.com/colorstay-ultimate-suede-lipstick?productId=xlsImpprod4950065","JG","IL",2,"I have to use chapstick as a heavy base before applying."
"http://www.ulta.com/colorstay-ultimate-suede-lipstick?productId=xlsImpprod4950065","Kelley","sacramento, ca",4,"worked well"
"http://www.ulta.com/colorstay-ultimate-suede-lipstick?productId=xlsImpprod4950065","LisaAnn","Whitewater, California",5,"This is the only lipstick I use, and it lasts all day.  Goes on smoothly, and keeps my lips moisturized.  I highly recommend!!"
"http://www.ulta.com/colorstay-ultimate-suede-lipstick?productId=xlsImpprod4950065","jacky","Davie, FL",1,"dry, rolled, yucky"
"http://www.ulta.com/colorstay-ultimate-suede-lipstick?productId=xlsImpprod4950065","Amy","Delano mn",5,"I love this lipstick I even use it for blush it's the perfect color!"
"http://www.ulta.com/colorstay-ultimate-suede-lipstick?productId=xlsImpprod4950065","Rosa","Fresno",1,"Gummy texture, my lips stuck together."
"http://www.ulta.com/colorstay-ultimate-suede-lipstick?productId=xlsImpprod4950065","Haylee",".",1,"I bought this product in the color Socialite. Not only was the color payoff disappointing, but it didn't last on my lips for more than an hour. The formula settles into cracks in the most unappealing way. It also has a horrible smell."
"http://www.ulta.com/colorstay-ultimate-suede-lipstick?productId=xlsImpprod4950065","Aruba Girl","Kokomo, IN",5,"I really like how the long the color lasted!"
"http://www.ulta.com/colorstay-ultimate-suede-lipstick?productId=xlsImpprod4950065","Chris","Chester, ny",5,"I love how this product stays on for hours."
"http://www.ulta.com/colorstay-ultimate-suede-lipstick?productId=xlsImpprod4950065","Nicole the Reasonable Spender","Corona, CA",5,"I use it everyday when I go out and it's safe to say that I only need to do at least ONE retouch all throughout the day! For someone who opt for a subtle look, I would recommend the Socialite color."
"http://www.ulta.com/colorstay-ultimate-suede-lipstick?productId=xlsImpprod4950065","M","Houston, TX",1,"I really wanted a long wearing lipstick but this one wore off unevenly and looked terrible shortly after application.  I would not recommend this product but I do like other Revlon lipsticks quite a bit."
"http://www.ulta.com/colorstay-ultimate-suede-lipstick?productId=xlsImpprod4950065","S. Chu","Fresno, Ca.",5,"Stays on and moistens lips too!"
"http://www.ulta.com/colorstay-ultimate-suede-lipstick?productId=xlsImpprod4950065","Mrs. Hollywood","Nc",5,"This lipstick goes on smooth but kind of finishes off semi matte finish."
"http://www.ulta.com/colorstay-ultimate-suede-lipstick?productId=xlsImpprod4950065","penny","orting, Washington",1,"Did not dry,and was messy"
"http://www.ulta.com/colorstay-ultimate-suede-lipstick?productId=xlsImpprod4950065","Kat","San Antonio",5,"Easy to use, long lasting, reasonably priced,hard to take off though. I own several colors, and I am very happy with the product."
"http://www.ulta.com/colorstay-ultimate-suede-lipstick?productId=xlsImpprod4950065","Mare","Indianapolis, IN",5,"I have gotten lots of compliments on this lipstick. Great pop of color but also natural enough looking that it isn't too dramatic for daytime wear"
"http://www.ulta.com/colorstay-ultimate-suede-lipstick?productId=xlsImpprod4950065","Astro Mama","Buckeye, AZ",4,"Finally something decent that looks natural on my olive skin. It's true to the outside container color, which is a plus. It's smooth to apply at first, but doesn't really re-apply well. I end up taking as much off as I can to re-apply. However, it's a great price and does last pretty well. I'll keep it all summer."
"http://www.ulta.com/colorstay-ultimate-suede-lipstick?productId=xlsImpprod4950065","Forever Young","Gulf Breeze, Fl.",5,"Finally a long lasting color that matches my skin."
"http://www.ulta.com/colorstay-ultimate-suede-lipstick?productId=xlsImpprod4950065","Lin","Baton Rouge la",5,"Awesome"
"http://www.ulta.com/colorstay-ultimate-suede-lipstick?productId=xlsImpprod4950065","Greeneyes47","Los Angeles, CA",5,"Very good lipstick overall."
"http://www.ulta.com/colorstay-ultimate-suede-lipstick?productId=xlsImpprod4950065","Pamsie","San diego",5,"Well this was not available for a long time.  I bought every tube I could find. Never have lipstick on teeth.  A bit dry but get used to it the extra moisture in lipsticks it what makes it disappear. Nice neutral colors.  Not as many as before the lighter pinks are moist.  Sometimes I mix colors.  When you have a job that you need to look put together and don't have a pocket or mirror  just wait until your break and you still have color I usually reapply."
"http://www.ulta.com/colorstay-ultimate-suede-lipstick?productId=xlsImpprod4950065","Mum","Colorado",4,"Like and will purchase another color"
"http://www.ulta.com/colorstay-ultimate-suede-lipstick?productId=xlsImpprod4950065","Cj","Grosse Ile, MI",4,"The product goes on nicely and evenly...the color would be fine for several skin tones"
"http://www.ulta.com/colorstay-ultimate-suede-lipstick?productId=xlsImpprod4950065","Shelby","Manchester,  NH",5,"No scent is so helpfull as I get migraines.  Bought in several colors after using first one for many days."
"http://www.ulta.com/colorstay-ultimate-suede-lipstick?productId=xlsImpprod4950065","Candi","Grand Rapids, MI",5,"I am not a huge lipstick wearer, so this is great because it stays on all day and I don't have to think about it."
"http://www.ulta.com/colorstay-ultimate-suede-lipstick?productId=xlsImpprod4950065","Beth","Statesville, NC",5,"This really stays put!!!  I have even slept in it and it stays on well."
"http://www.ulta.com/colorstay-ultimate-suede-lipstick?productId=xlsImpprod4950065","Classy Chic","El Paso, TX",2,"I was hoping this would be the red it looked like in the packaging but it was actually quite pink. Coverage is also minimal and sticky- it made my lips chapped and wore off very fast. I'd look elsewhere for a good non drying, lasting lipstick."
"http://www.ulta.com/colorstay-ultimate-suede-lipstick?productId=xlsImpprod4950065","Teta","Sparks, Nevada",3,"I use over other lipstick for shine"
"http://www.ulta.com/colorstay-ultimate-suede-lipstick?productId=xlsImpprod4950065","Cherry Pie","Wilmington, NC",5,"I wear this EVERYDAY!!!  I have 10 tubes of this color and they are in my car, my briefcase, my purse, my makeup drawer, my makeup travel bags, in my kitchen, etc. the thing I love is that it lasts a long time and doesn't dry out my lips. I have tried lots of other brands and this is the best by far."
"http://www.ulta.com/colorstay-ultimate-suede-lipstick?productId=xlsImpprod4950065","Hez","Tn",5,"I picked this up on a whim not knowing anything about it , other than the fact that revlon is my favorite drugstore brand . I really had zero expectations with this product &amp; just wanted a new shade to play with. I am very pleasantly surprised &amp; now have a new go to lipstick ! Upon application this applied very smoothly &amp; evenly . For me it wasn't drying at all (but I do live in lip balm when not in lipstick) I went about my day again not expecting anything , BUT then through eating spaghetti &amp; drinking ,brushing my teeth AND falling asleep, then eating &amp; drinking again .....this is still on as if it were freshly applied !!!!! I am so happy I stumbled across this . The price for the quality is really good as well compared to what I have paid with other lipsticks that do not hold up even half as good. I purchased this in shade Iconic &amp; I feel this particular color can be worn anytime for any occasion . I will definitely repurchase &amp; try out other colors in this line ."
"http://www.ulta.com/colorstay-ultimate-suede-lipstick?productId=xlsImpprod4950065","Vic","Orlando, FL",3,"This says it is a suede finish, but it's more metallic than I would like."
"http://www.ulta.com/colorstay-ultimate-suede-lipstick?productId=xlsImpprod4950065","rocklassic","Kansas City",2,"Color was good. Applied smoothly. However, became dry very quickly and made lips very tacky."
"http://www.ulta.com/colorstay-ultimate-suede-lipstick?productId=xlsImpprod4950065","Rocky","Evanston, IL",2,"Not much color at all in this lipstick, I like to look natural, but this was pretty much as good as wearing nothing. It's so difficult to choose a lipstick when there's no tester and you just have to wing it. The color looked ok, but once it was applied, it just disappeared on me. I plan to return this product."
"http://www.ulta.com/colorstay-ultimate-suede-lipstick?productId=xlsImpprod4950065","Kaitlyn","Bowling Green Ky",4,"I had bought this to use as stage makeup, but it wasn't quite right for that. But it is perfect for what I was looking for in an everyday color."
"http://www.ulta.com/colorstay-ultimate-suede-lipstick?productId=xlsImpprod4950065","Squish","Illinois",5,"This lipstick line never disapoints me and it lasts my whole work day without needing touchups! I even eat apples and it doesnt rub off!"
"http://www.ulta.com/colorstay-ultimate-suede-lipstick?productId=xlsImpprod4950065","HockeyGirl","Indiana",4,"I've tried several different lipsticks over the years, and I am increasing my collection with this type of lipstick. It isn't clumpy and it stays put for several hours, even after eating! For the price, it's one of my go to's anytime!"
"http://www.ulta.com/colorstay-ultimate-suede-lipstick?productId=xlsImpprod4950065","Simone","Louisville, Ky",5,"I have used this product for years! The only issue that I have with it is the small amount in the container. I use lipstick every day and need a larger amount."
"http://www.ulta.com/colorstay-ultimate-suede-lipstick?productId=xlsImpprod4950065","candy_kane73","Brooksville,Florida",3,"everyday wear"
"http://www.ulta.com/colorstay-ultimate-suede-lipstick?productId=xlsImpprod4950065","Bubbles","Florida",2,"Not long lasting, thick and pasty, drying to lips"
"http://www.ulta.com/colorstay-ultimate-suede-lipstick?productId=xlsImpprod4950065","Karen","Calhoun City, MS",1,"I just did not care for this product.  I don't like dry flat colors."
"http://www.ulta.com/colorstay-ultimate-suede-lipstick?productId=xlsImpprod4950065","N","Chicago IL",4,"None"
"http://www.ulta.com/colorstay-ultimate-suede-lipstick?productId=xlsImpprod4950065","Happy with my lipstick","MI",4,"Pairs perfectly with my Bert's Bees lip gloss. The color stays for hours even though I tend to chew on my lip - longer than any other lipstick I've tried."
"http://www.ulta.com/colorstay-ultimate-suede-lipstick?productId=xlsImpprod4950065","Ms. Dawn","Warren, Mi",5,"Love it"
"http://www.ulta.com/colorstay-ultimate-suede-lipstick?productId=xlsImpprod4950065","MamaK","Chicago Area",2,"This felt good when first applying; however, after about 15 minutes, I noticed that my lips were completely tacky. Quite disappointing. I still need to return it."
"http://www.ulta.com/colorstay-ultimate-suede-lipstick?productId=xlsImpprod4950065","Deedee","Mi",5,"All good about it"
"http://www.ulta.com/colorstay-ultimate-suede-lipstick?productId=xlsImpprod4950065","KittyRunThis","Ny Ny",5,"I use this product daily , it's affordable and long lasting"
"http://www.ulta.com/colorstay-ultimate-suede-lipstick?productId=xlsImpprod4950065","Eljay","San Antonio, TX",5,"I like the &quot;tint&quot; that remains on the lips when the lipstick wears off so that there never is a totally washed out look."
"http://www.ulta.com/colorstay-ultimate-suede-lipstick?productId=xlsImpprod4950065","Brigy305","Miami",1,"This stuff just sucks. I have bought at least 4 colors and all of them are horrible. The concept is good but it clumps up and gets sticky and it's so hard to remove."
"http://www.ulta.com/colorstay-ultimate-suede-lipstick?productId=xlsImpprod4950065","Molly","Arlington Texas",5,"I love the feel of this lipstick.  I've gotten a lot of compliments on the color."
"http://www.ulta.com/colorstay-ultimate-suede-lipstick?productId=xlsImpprod4950065","Lisa","Austin, tx",4,"I tend to be very natural in my choices yet I like to add color especially to my lips. This I debated with between a calvin klein one. I got both but have been using this one and not that one. The color truly does last and it isn't drying like most."
"http://www.ulta.com/colorstay-ultimate-suede-lipstick?productId=xlsImpprod4950065","parteegal","Indio CA",4,"It does last longer than other more expensive dept. store brands received in a gift with purchase, but does feel a bit dry on my lips"
"http://www.ulta.com/colorstay-ultimate-suede-lipstick?productId=xlsImpprod4950065","Martina","Mineola, tx",5,"It's impressive for the price . It does stay all day ! It looks the same as it does when I apply it first thing in the morning , even after a workout !<br />It doesn't look dry"
"http://www.ulta.com/colorstay-ultimate-suede-lipstick?productId=xlsImpprod4950065","Mimilsu","Riverside ca",2,"Too shimmery when I bought it didn't even see the glitter on it thought it was a mode pink color , turned out to have shimmer in it . Looks like something my 6 year old sister would wear"
"http://www.ulta.com/colorstay-ultimate-suede-lipstick?productId=xlsImpprod4950065","Maria","Kennewick, WA",1,"I loved the colors, and &quot;suede&quot; made me thing of something between a matte and traditional lipstick so I thought I'd give it a go.<br /><br />The color was perfect but sadly I'll be tossing this one out. It goes on well but drys super sticky. After the sticky stage your lips are super dry and it look patchy. It settles in the lines and a second application only makes it worse. You pretty much of to take it all of and start over."
"http://www.ulta.com/colorstay-ultimate-suede-lipstick?productId=xlsImpprod4950065","Deb","New Jersey",4,"This lipstick lasted all day, even when eating!"
