"url","name","location","rating","review"
"http://www.ulta.com/colorstay-ultimate-liquid-lipcolor?productId=xlsImpprod1380102","Emma Gal","Daytona Beach, FL",5,"I absolutely LOVE this product. I was looking for something long lasting that I could wear to school and last in the Florida heat. This product does it all. It doesn't dry out my lips like other liquid lipsticks and my friends always ask me if I re-apply my lips; the answer is never! Holy Grail!"
"http://www.ulta.com/colorstay-ultimate-liquid-lipcolor?productId=xlsImpprod1380102","cyndi","Burlington, ky",5,"I really like how this stays on all day."
"http://www.ulta.com/colorstay-ultimate-liquid-lipcolor?productId=xlsImpprod1380102","missy","pittsburgh",5,"It really lasts long"
"http://www.ulta.com/colorstay-ultimate-liquid-lipcolor?productId=xlsImpprod1380102","Sharon","Henderson, NV",3,"I use this as a base color coat, then add lipstick on top because it feels so dry, otherwise.  If the lipstick wears off, I still have some color."
"http://www.ulta.com/colorstay-ultimate-liquid-lipcolor?productId=xlsImpprod1380102","Janie","Aurora, CO",5,"The Revlon Colorstay lipcolors are really nice, and last a long time. If you experience any dryness, use gloss over it. Can also use a lip mask if needed."
"http://www.ulta.com/colorstay-ultimate-liquid-lipcolor?productId=xlsImpprod1380102","Sharon Product Junkie","Knoxville TN",4,"I have used many long lasting lipsticks and some flake off during the day.  This stayed on beautifully.  It did make my lips slightly dry but did not flake and it was east to wash off."
"http://www.ulta.com/colorstay-ultimate-liquid-lipcolor?productId=xlsImpprod1380102","Lovely LIps","Sandpoint,ID",5,"Great product! It does come off if you constantly rub your lips together (and it gathers at the edge of your lip). But it is the best product, it doesn't feel sticky like other long lasting lip sticks."
"http://www.ulta.com/colorstay-ultimate-liquid-lipcolor?productId=xlsImpprod1380102","Becky bug","Bakersfield, CA",5,"Love it, I use it all the time"
"http://www.ulta.com/colorstay-ultimate-liquid-lipcolor?productId=xlsImpprod1380102","Wendy","Slidell, LA",5,"Love Color #30, lasts all day!!"
"http://www.ulta.com/colorstay-ultimate-liquid-lipcolor?productId=xlsImpprod1380102","Miss Vanity","Los Angeles",1,"This lipstick bleeds and then becomes matty"
"http://www.ulta.com/colorstay-ultimate-liquid-lipcolor?productId=xlsImpprod1380102","me","sacramento, ca",4,"I like that the color stays on.  I have to apply carefully, if you go off your lips and don't remove it right away it stains your face. The darker colors are sometimes harsh, Not enough color choices."
"http://www.ulta.com/colorstay-ultimate-liquid-lipcolor?productId=xlsImpprod1380102","katbmakeup","Miami, Florida",3,"This liquid lipstick applies smoothly but it's incredibly sticky and needs a balm or gloss over it in order to make it wearable. It's not very pigmented but it is buildable. Be aware that these are not matter at all (both of the ones I bought have glitter). Premium pink is a beautiful everyday pink color. It DEFINITELY does not stay on for 12 hours -- maybe 3 hours or until you eat. I probably wouldn't buy again.. I rather spend double the price and get a great product."
"http://www.ulta.com/colorstay-ultimate-liquid-lipcolor?productId=xlsImpprod1380102","DANCIN' GIRL","Ft. Myers",5,"I can't tell you how fabulous this is!  Apply then blot with Kleenex and repeat if you want deeper color.  It lasts several hours amazingly!<br />Easily removed with Ponds Cold Cream."
"http://www.ulta.com/colorstay-ultimate-liquid-lipcolor?productId=xlsImpprod1380102","Bella","South caroliner",5,"I think this is a great product. Love the color and it lasts"
"http://www.ulta.com/colorstay-ultimate-liquid-lipcolor?productId=xlsImpprod1380102","Peggy","Portland, Oregon",4,"Use this product every day &amp; do not need to reapply during the day.  Because it dries quickly after applying I always use a lip balm on top."
"http://www.ulta.com/colorstay-ultimate-liquid-lipcolor?productId=xlsImpprod1380102","Kat","Montgomery, Al",4,"Apply in the morning...stays on all day."
"http://www.ulta.com/colorstay-ultimate-liquid-lipcolor?productId=xlsImpprod1380102","mermaid","Seattle",5,"The is long lasting and beautiful colors"
"http://www.ulta.com/colorstay-ultimate-liquid-lipcolor?productId=xlsImpprod1380102","Susan","Dallas/Ft. Worth",5,"Lasts thought the day and I don't have to worry about re-applying after a meal."
"http://www.ulta.com/colorstay-ultimate-liquid-lipcolor?productId=xlsImpprod1380102","Susane","Sacramento, Calif.",3,"I use long lasting lipsticks because I am an attorney and I'm in court all day long."
"http://www.ulta.com/colorstay-ultimate-liquid-lipcolor?productId=xlsImpprod1380102","marilda","Delawere",5,"long lasting"
"http://www.ulta.com/colorstay-ultimate-liquid-lipcolor?productId=xlsImpprod1380102","runspellthat","Atlanta, GA",4,"Long lasting color,but at the location fpurchase the color selection was limmited"
"http://www.ulta.com/colorstay-ultimate-liquid-lipcolor?productId=xlsImpprod1380102","Terry","Richmond, VA",1,"Take it off the market."
"http://www.ulta.com/colorstay-ultimate-liquid-lipcolor?productId=xlsImpprod1380102","Sandeecos","Colorado Springs",5,"Great color selection &amp; really long lasting!"
"http://www.ulta.com/colorstay-ultimate-liquid-lipcolor?productId=xlsImpprod1380102","chaeysa","Pasadena, CA",4,"I own 3 colors from this line and I LOVE them all.  The only downside is that the shine wears off but that seems to be the downfall of all long-wearing lips products."
"http://www.ulta.com/colorstay-ultimate-liquid-lipcolor?productId=xlsImpprod1380102","Jennifer","Tampa Bay, FL",2,"Too dry on lips"
"http://www.ulta.com/colorstay-ultimate-liquid-lipcolor?productId=xlsImpprod1380102","lindafitz57","Niceville, fl",5,"Finally found a long lasting lipstick that goes on smooth and last all day"
"http://www.ulta.com/colorstay-ultimate-liquid-lipcolor?productId=xlsImpprod1380102","Ei","NY",1,"Did not like this.  Left terrible film on my lips and was hard to get off."
"http://www.ulta.com/colorstay-ultimate-liquid-lipcolor?productId=xlsImpprod1380102","no nick name","Gilbert AZ",5,"works great, stays on for a long time."
"http://www.ulta.com/colorstay-ultimate-liquid-lipcolor?productId=xlsImpprod1380102","Ruthbunny","Kansas City, MO",5,"I have used this since it came out. I am a nurse and work 12-16 hrs a day and I can count on this to keep my lips beautiful till I take it off at night. I hope they never stop making it!!"
"http://www.ulta.com/colorstay-ultimate-liquid-lipcolor?productId=xlsImpprod1380102","Wear little makeup","FL",5,"I am really enjoying using this product. I use it everyday and I find that my lips do not get as dry as they did with the other product that I had been using. And best of all I feel like I get more bang for my buck!"
"http://www.ulta.com/colorstay-ultimate-liquid-lipcolor?productId=xlsImpprod1380102","vrmerriman","Dayton, OH",2,"I selected the Premium Pink because it strongly reminded me of a Chanel lip gloss I wore in college.  Unfortunately, it was not so.  The color both online and in person shows a light shimmer to the product when in fact the product dries to a very matte finish.  I loved how easy the application was and thought the product would remain glossy, but instead it dried after a minute and remained very tacky.  I felt the need to apply a moisturizing gloss or lip balm over the top.  While the pigmentation was pretty, it was not what I was looking for at all."
"http://www.ulta.com/colorstay-ultimate-liquid-lipcolor?productId=xlsImpprod1380102","D","Wichita, Ks.",5,"Long lasting and wonderful coverage for the lips."
"http://www.ulta.com/colorstay-ultimate-liquid-lipcolor?productId=xlsImpprod1380102","Majinat","Mobile, AL",2,"Did not work for me.  Lips got way too dry.  Needed lip gloss to give lips moisture."
"http://www.ulta.com/colorstay-ultimate-liquid-lipcolor?productId=xlsImpprod1380102","Dawn","Florida",5,"Long lasting"
"http://www.ulta.com/colorstay-ultimate-liquid-lipcolor?productId=xlsImpprod1380102","Mac","Asheville, NC",4,"I have this product in several colors and Love it!"
"http://www.ulta.com/colorstay-ultimate-liquid-lipcolor?productId=xlsImpprod1380102","Chanitele","FH, MI",3,"This was supposed to be 24 hour lasting. But it does not even last for 4 hours!!!"
"http://www.ulta.com/colorstay-ultimate-liquid-lipcolor?productId=xlsImpprod1380102","SW","Houston, Texas",5,"Heard they Revlon was discontinuing this product. Was very disappointed. Love it. Color is great and it stays on."
"http://www.ulta.com/colorstay-ultimate-liquid-lipcolor?productId=xlsImpprod1380102","Mimi","Columbia, SC",5,"I love this product. I have been using it ever since I first started wearing make-up in highschool and have never used any other kind of lipstick! it is long lasting and the colors are beautiful, I just wish there was more selection. The only con is that it will dry out your lips, but after applying if you just wait 5 minutes and throw on some chapstick you will be good to go! I recommend this product to everyone I know"
"http://www.ulta.com/colorstay-ultimate-liquid-lipcolor?productId=xlsImpprod1380102","Pattie O","Eastvale,  Ca.",5,"I put it on in the morning, and late afternoon. What's left the next morning, I remove with a little coconut oil and start over."
"http://www.ulta.com/colorstay-ultimate-liquid-lipcolor?productId=xlsImpprod1380102","curious1","Texas",1,"Must use a lip balm or gloss with this. Or it can feel very annoying."
"http://www.ulta.com/colorstay-ultimate-liquid-lipcolor?productId=xlsImpprod1380102","NudeLook","San Jose",1,"The colors look pretty but it left a film on my lips that looked bad."
"http://www.ulta.com/colorstay-ultimate-liquid-lipcolor?productId=xlsImpprod1380102","Marcella","Naperville, il",5,"Love it - one of my favorites to use daily. Nice value"
"http://www.ulta.com/colorstay-ultimate-liquid-lipcolor?productId=xlsImpprod1380102","Marcella","Naperville, il",5,"really like it - nice price good quality"
"http://www.ulta.com/colorstay-ultimate-liquid-lipcolor?productId=xlsImpprod1380102","niecey","bloomimgdale,il",5,"lipstick all day long"
"http://www.ulta.com/colorstay-ultimate-liquid-lipcolor?productId=xlsImpprod1380102","Ponygirl","Indianapolis, IN",5,"Fantastic, easy application, stays on, great color choices."
"http://www.ulta.com/colorstay-ultimate-liquid-lipcolor?productId=xlsImpprod1380102","Jody","Oro Valley, AZ",3,"Stays on but you need a mosterizer over it. Feels dry."
"http://www.ulta.com/colorstay-ultimate-liquid-lipcolor?productId=xlsImpprod1380102","LindasLips","Sacramento, CA",5,"I love that Revlon has found natural colors that are not over the top in intensity. I have several of these and have been happy with every color. I like that I can apply my color in the morning and just shine it up with a gloss during the day. It makes sense for me. I may even toss all my other lipsticks."
"http://www.ulta.com/colorstay-ultimate-liquid-lipcolor?productId=xlsImpprod1380102","Linda T","Cincinnati, OH",4,"Great long wearing lip product--great colors."
"http://www.ulta.com/colorstay-ultimate-liquid-lipcolor?productId=xlsImpprod1380102","Ellie","Pleasant Prairie WI",5,"Great to use on its own or as a base for a similar color gloss to add staying power.  The stain will last for many hours, and even through eating.  I have it in several colors and it's my favorite lip base.  The slight stickiness (more like a tape-y tackiness) is not very bothersome and worth it for the color staying ON."
"http://www.ulta.com/colorstay-ultimate-liquid-lipcolor?productId=xlsImpprod1380102","camomile7","midwest",5,"I picked these up one day and I am so glad I did! A staple in my makeup bag forever"
"http://www.ulta.com/colorstay-ultimate-liquid-lipcolor?productId=xlsImpprod1380102","Yvette","Ohio",3,"It is not very long lasting. I usually reapply by lunch time. The color is nice but not 12hour long lasting as it claims."
"http://www.ulta.com/colorstay-ultimate-liquid-lipcolor?productId=xlsImpprod1380102","Lin","tennessee",4,"I use this product daily"
"http://www.ulta.com/colorstay-ultimate-liquid-lipcolor?productId=xlsImpprod1380102","Patricia","Lexington, KY",4,"This lipstick stays on very well and comes in numerous colors. Did not dry out my lips like many other brands have.  I wish I had several!"
"http://www.ulta.com/colorstay-ultimate-liquid-lipcolor?productId=xlsImpprod1380102","crazy4tzus","Cedar Rapids, IA",4,"I love the product even though I needed to re-apply after eating. Nice long-wearing color. Did not dry out my lips."
"http://www.ulta.com/colorstay-ultimate-liquid-lipcolor?productId=xlsImpprod1380102","Carol","Chicago suburb",5,"I like the minimal amount of time for the maximum effect.  Revlon Colorfast Liquid Lipcolor provides that.  Once a day, generally in the morning, sometimes a refresh in the evening and I don't worry about lip color all day.  If I apply it in the evening it's still there in the morning.  Can't get easier than that."
"http://www.ulta.com/colorstay-ultimate-liquid-lipcolor?productId=xlsImpprod1380102","pattij","arizona",5,"Hard to find, I have tried other brands, but, they don't last as long"
"http://www.ulta.com/colorstay-ultimate-liquid-lipcolor?productId=xlsImpprod1380102","none","Ooltewah, TN",5,"I use Colorstay everyday---I am 72 (don't look it though) and it doesn't bleed into liplines, stays true to color and doesn't fade.  My only complaint is it is a little drying and my favorite color was discontinued."
"http://www.ulta.com/colorstay-ultimate-liquid-lipcolor?productId=xlsImpprod1380102","ItzKat","El Paso, TX",4,"Once you perfect the application, you're good to go all day!"
"http://www.ulta.com/colorstay-ultimate-liquid-lipcolor?productId=xlsImpprod1380102","sara","albuquerque,nm",2,"made lips dry, clumpy, moved easily and got on teeth."
"http://www.ulta.com/colorstay-ultimate-liquid-lipcolor?productId=xlsImpprod1380102","Amazing Grace","Mauldin, South Carolina",5,"Love it, and I recommed to all my friends...they marvel at how long it lasts and how fresh it looks."
"http://www.ulta.com/colorstay-ultimate-liquid-lipcolor?productId=xlsImpprod1380102","meh97303","Keizer, Oregon",5,"This stays on from morning to night. All I have to touch up on is a gloss which I reapply throughout the day, especially after meals. Depending on what you eat, you may have to reapply the color as a touch up. Are you dabbing at your mouth with a napkin or rubbing? This makes a difference for any lipstick. Overall, this is my favorite lipstick. They have an 18 and 24 hour one also."
"http://www.ulta.com/colorstay-ultimate-liquid-lipcolor?productId=xlsImpprod1380102","Penny","Virginia",3,"I use this product as I work the front desk of a busy office.  After a while the application clumps and is unattractive.  I won't use again"
"http://www.ulta.com/colorstay-ultimate-liquid-lipcolor?productId=xlsImpprod1380102","Nurse","Kokomo, IN",4,"I have used this for a couple years now and nothing I have found lasts as long. I have gotten up the next morning and still had some left on from the morning before. Doesn't always last that long but it has."
"http://www.ulta.com/colorstay-ultimate-liquid-lipcolor?productId=xlsImpprod1380102","PJ","Oklahoma City, OK",5,"This is the only brand of long lasting lip color that stays on me."
"http://www.ulta.com/colorstay-ultimate-liquid-lipcolor?productId=xlsImpprod1380102","Kchavez","Sicklerville, NJ",3,"Love the color of this product. The only thing I didn't like about it was once it's applied it leaves lips feeling sticky and dry."
"http://www.ulta.com/colorstay-ultimate-liquid-lipcolor?productId=xlsImpprod1380102","rstats","michigan",1,"don't like it"
"http://www.ulta.com/colorstay-ultimate-liquid-lipcolor?productId=xlsImpprod1380102","GramE","Omaha, NE",1,"Returning, smudges"
"http://www.ulta.com/colorstay-ultimate-liquid-lipcolor?productId=xlsImpprod1380102","Angel ","Massachusetts",4,"Was told by a friend about this product <br />Have tried many brands that just don't last.    Revlon color stay stand up to its name"
"http://www.ulta.com/colorstay-ultimate-liquid-lipcolor?productId=xlsImpprod1380102","Dennie","Casa Grande, AZ",5,"I can use this Revlon lipstick in the morning &amp; still have color in the evening."
"http://www.ulta.com/colorstay-ultimate-liquid-lipcolor?productId=xlsImpprod1380102","Vladimir the Impaler","Tennessee",5,"I put one application on in the morning and it lasts all day, it will even last through sleeping. For 10$ you DEFINITELY get what you're paying for."
"http://www.ulta.com/colorstay-ultimate-liquid-lipcolor?productId=xlsImpprod1380102","Heaven","Idaho",1,"I like the color and how it applies but as soon as it dries, it gets really sticky. It's uncomfortable. I put petroleum jelly over it and that fixes the stickiness, but it looks really dry and gets deep into the cracks of your lips."
"http://www.ulta.com/colorstay-ultimate-liquid-lipcolor?productId=xlsImpprod1380102","StephanieJean","Milwaukee, Wi",4,"This lipstick has serious staying power and is completely transfer proof. It is a bit sticky when you first put it on, but then it dries. It's not as opaque as I'd like, but a few coats get the job done!"
"http://www.ulta.com/colorstay-ultimate-liquid-lipcolor?productId=xlsImpprod1380102","No.1Teacher","Orlando, FL",3,"Good choice for one-step long lasting lipcolor, but does not have the staying power of the 2-step Colorstay products which stay on 12+ hours. This one wears off around 6 hours so you will need to carry it and reapply in the afternoon for all-day wear. I teach school so I have no time to reapply! I was excited for a one-step version, however the 2-step original is superior for all-day wear."
"http://www.ulta.com/colorstay-ultimate-liquid-lipcolor?productId=xlsImpprod1380102","Joy","Santa Clara, CA",5,"Long lasting stay lipstick"
"http://www.ulta.com/colorstay-ultimate-liquid-lipcolor?productId=xlsImpprod1380102","JLWC","Charlotte NC",2,"Color looked great in the bottle but when it was applied it was definitely not as rich.  Also, the application was not as even as it should have been.  It almost looked like a child coloring outside the lines.  Definitely not my first attempt at lip gloss either :-) Great idea, bad execution."
"http://www.ulta.com/colorstay-ultimate-liquid-lipcolor?productId=xlsImpprod1380102","lynnie","wayne, MI",5,"This is the only lipcolor I use anymore. It doesn't dry out my lips and it stays on all day."
"http://www.ulta.com/colorstay-ultimate-liquid-lipcolor?productId=xlsImpprod1380102","Susa","Muskegon, MI",1,"The product does not dry quickly. It is gummy and sticky."
"http://www.ulta.com/colorstay-ultimate-liquid-lipcolor?productId=xlsImpprod1380102","sari","edina mn",5,"I really love the color and i wear it daily,only bad side is dries out the lips fast."
"http://www.ulta.com/colorstay-ultimate-liquid-lipcolor?productId=xlsImpprod1380102","Betty","Fort Myers, FL",4,"This product stays on all day and it doesn't run into the little lines above my lips. I love having color on my lips without reapplying all day!"
"http://www.ulta.com/colorstay-ultimate-liquid-lipcolor?productId=xlsImpprod1380102","Lin","tennessee",4,"I use this product daily"
"http://www.ulta.com/colorstay-ultimate-liquid-lipcolor?productId=xlsImpprod1380102","Marie 76","San Antonio, TX",4,"I love the color and I tend to use it with a clear lip gloss.  The only thing is it's sticky without lip gloss."
"http://www.ulta.com/colorstay-ultimate-liquid-lipcolor?productId=xlsImpprod1380102","Deb","Wylie,TX",5,"I love that I can drink out of a cup and the color stays on my lips and not my cup!"
"http://www.ulta.com/colorstay-ultimate-liquid-lipcolor?productId=xlsImpprod1380102","atmill","Georgia",1,"I loved the colors and applicator but returned the product for the following reasons: lipstick did not seem to dry completely, had a tacky sticky feel to it, and it did start to come off when I ate and blotted my mouth with a napkin.  It did not begin to compare with other 12-24 hour lipsticks I use. I hated it did not work well due to the colors were beautiful."
"http://www.ulta.com/colorstay-ultimate-liquid-lipcolor?productId=xlsImpprod1380102","weezie","york pa",4,"my mistake.. had to return for different color. Vampire red not good for me"
"http://www.ulta.com/colorstay-ultimate-liquid-lipcolor?productId=xlsImpprod1380102","The Extractor","Brentwood, CA",5,"I LOVE this product!! I'm an esthetician &amp; have tried a LOT of &quot;long-lasting&quot; lip colors...but this one is definitely my fave....eating, dancing, sweating, working out, making out...lasts until you take it off!  It can be a little drying, but an application of ur fave lip moisturizer will help."
"http://www.ulta.com/colorstay-ultimate-liquid-lipcolor?productId=xlsImpprod1380102","Hotmel86","Acworth, ga",3,"Nice not to have to reapply"
"http://www.ulta.com/colorstay-ultimate-liquid-lipcolor?productId=xlsImpprod1380102","Kimber","Port St Lucie, FL",1,"The color was not true and it is really drying. The worst part is it rubs off easy. I won't buy this again."
"http://www.ulta.com/colorstay-ultimate-liquid-lipcolor?productId=xlsImpprod1380102","Kassle","Camp Hill, PA",4,"Goes on easily and evenly.  Sticky when it goes on (stays sticky for quite awhile,) then is a bit drying.  But I do like the color, and I'm not going to say it stays 12 hours, but it is long-lasting."
"http://www.ulta.com/colorstay-ultimate-liquid-lipcolor?productId=xlsImpprod1380102","Honeyboo","Sacramento, CA",5,"Love this product. Last all day and blends well with my lip liner. The peach shades enhance my lip color for that natural look and the pink shades give a bolder statement for my trendy style. When applying you need to my sure theres not to much product on the applicator."
"http://www.ulta.com/colorstay-ultimate-liquid-lipcolor?productId=xlsImpprod1380102","Brie","Minneapolis, MN",1,"This product goes on so sticky and they dries very matte, it has horrible color pay off and doesn't last long, not a FAN!!"
"http://www.ulta.com/colorstay-ultimate-liquid-lipcolor?productId=xlsImpprod1380102","Kathy","Paramus, NJ",1,"I was very disappointed.The color dries different then when applied and unfortunetly I wore it THE COMPLETE day  looking ridiculous because it does truely stay on"
"http://www.ulta.com/colorstay-ultimate-liquid-lipcolor?productId=xlsImpprod1380102","Peggy","Glendora CA",3,"It applies very thick and gloppy.  I prefer the other Revlon liquid lipstick."
"http://www.ulta.com/colorstay-ultimate-liquid-lipcolor?productId=xlsImpprod1380102","queensimba","Kent, Seattle",5,"This product has staying power, a little drying but just go light when applying it, wait until it dries and add a light layer of Revlon ColorStay Mineral lipglaze on top and your lips will keep the color and moisture even after eating. The selection of colors is not very good, but over all I do recomend this product, better than pricier ones."
"http://www.ulta.com/colorstay-ultimate-liquid-lipcolor?productId=xlsImpprod1380102","Gee","Dallas, TX",1,"Not that good"
"http://www.ulta.com/colorstay-ultimate-liquid-lipcolor?productId=xlsImpprod1380102","Pg","Gainesville, fl",3,"at the end of the day, though this product is better than the long lasting lipsticks that went before, it is still drying  and sticky."
"http://www.ulta.com/colorstay-ultimate-liquid-lipcolor?productId=xlsImpprod1380102","Don't have one","Panama City Beach, Fl.",5,"I luv how it stays on all day for work. I Can Eat &amp; It's Still on."
"http://www.ulta.com/colorstay-ultimate-liquid-lipcolor?productId=xlsImpprod1380102","Shell","Rapid City, SD",5,"Lasts all day!!"
"http://www.ulta.com/colorstay-ultimate-liquid-lipcolor?productId=xlsImpprod1380102","Doris","Palm Beach Gardens FL",5,"This is the only lipstick that I apply in the AM and lasts all day"
"http://www.ulta.com/colorstay-ultimate-liquid-lipcolor?productId=xlsImpprod1380102","Wendy C.","West Des Moines",5,"This feels like a gloss and not a stain, but stays on all day. By far the best all day wear product I have found"
"http://www.ulta.com/colorstay-ultimate-liquid-lipcolor?productId=xlsImpprod1380102","Rockboice","Upstate ny",3,"beautiful color. not exactly true but a nice shade. the application can be a little tricky to get it all even. its a gloss style but long wearing. dries fast so work fast. the color did stay on and didn't transfer. as with all long wear it can feel drying and sticky. I put a little balm from another long wear over it and it was fine."
"http://www.ulta.com/colorstay-ultimate-liquid-lipcolor?productId=xlsImpprod1380102","B","Wisconsin",4,"Extremely long lasting with a liner<br />Clumps with certain liners"
"http://www.ulta.com/colorstay-ultimate-liquid-lipcolor?productId=xlsImpprod1380102","Gina","Niceville, FL",5,"i am a Quad (paralyzed) and limit use of my hands so i use my mouth a lot(opening a pen cap or adjusting things in my hands) the color still last all day even though I use my mouth constantly."
"http://www.ulta.com/colorstay-ultimate-liquid-lipcolor?productId=xlsImpprod1380102","Teci","Sun City CENTER, Fl",5,"I've tried many lipsticks and finally found one that stays on all day."
"http://www.ulta.com/colorstay-ultimate-liquid-lipcolor?productId=xlsImpprod1380102","Aurora g","Pearsall, TX",5,"I use this lipstick everyday and would not trade it for anything."
"http://www.ulta.com/colorstay-ultimate-liquid-lipcolor?productId=xlsImpprod1380102","Manu","Claymont, De",4,"this product is good. and long lasting.<br />will surely buy more of this."
"http://www.ulta.com/colorstay-ultimate-liquid-lipcolor?productId=xlsImpprod1380102","Val T","Seattle, WA.",4,"I love this product because I can put it on once in the morning and it stays on all day long.  Even thru meals and beverages."
