"url","name","location","rating","review"
"http://www.ulta.com/colorstay-concealer?productId=xlsImpprod4960009","qt","fort worth",4,"It is rather orange but usually covers well. With the powder I use it stays on pretty well. I have had problems with this concealer creasing and melting because of my oily skin but a little extra powder in problem areas helps a lot. <br />However, I have fallen asleep in this concealer and it did not stay on. Definitely doesn't last 24 hours. With good setting powder it can last a solid 8 without looking gross though."
"http://www.ulta.com/colorstay-concealer?productId=xlsImpprod4960009","JustJ","Hamburg, PA",5,"I use this for an everyday under eye concealer. I've had a lot of trouble finding an affordable concealer that is both pale and cool enough for my skin, but this is working well! It's not as creamy as a high end product, but if you're on a budget this works well for everyday."
"http://www.ulta.com/colorstay-concealer?productId=xlsImpprod4960009","Brittany","Swanton Ohio",1,"Didn't stay good at all"
"http://www.ulta.com/colorstay-concealer?productId=xlsImpprod4960009","Brandie","Florida",1,"After wearing this concealer for an hour (under my foundation) it oxidized and turned dark so I had dark circles that I didn't even have before I put it on! I had to go home and wash it off. Worst concealer I've ever used"
"http://www.ulta.com/colorstay-concealer?productId=xlsImpprod4960009","Makeup lover","San bernardino",5,"I use as a base under my eyes before i apply ben nye banana powder."
"http://www.ulta.com/colorstay-concealer?productId=xlsImpprod4960009","Sasha","Muncie In",5,"My best friend,  lol."
"http://www.ulta.com/colorstay-concealer?productId=xlsImpprod4960009","Sidney","Charlotte, NC",2,"I love the colorstay foundation for the coverage but this concealer was extremely disappointing."
"http://www.ulta.com/colorstay-concealer?productId=xlsImpprod4960009","Princess","Longview,Tx.",5,"My mom wanted to try this. I did her makeup. It was great for her. It covered up her dark circles under her eyes,blemishes,and other no fun spots on her face. She loved it and was surprised on how well it worked for her. She has dry skin."
"http://www.ulta.com/colorstay-concealer?productId=xlsImpprod4960009","none","Peachtree City, GA",5,"Good to apply before make up for covering under eye circles and facial brown spots."
"http://www.ulta.com/colorstay-concealer?productId=xlsImpprod4960009","Lia","Wichita Kansas",5,"."
"http://www.ulta.com/colorstay-concealer?productId=xlsImpprod4960009","wildts","new orleans",1,"This just would not blend. There is nothing worse than putting concealer under your eyes and just looking like a two toned ghost..... no amount of dabbing helped...."
"http://www.ulta.com/colorstay-concealer?productId=xlsImpprod4960009","B","San Leandro",5,"I typically buy the brand name concealer but decided to try this one and was pleasantly surprised. It went on smoothly, coverage was good, and matched my skin tone well. The only con I found is that after some hours of wear, the color fades (and unveiled some of my hyper pigmentation.) Easy fix is to apply more. Price point is great and I will be purchasing again for daily use."
"http://www.ulta.com/colorstay-concealer?productId=xlsImpprod4960009","Bev","Dorton Kentucky",5,"I liked the product very well."
"http://www.ulta.com/colorstay-concealer?productId=xlsImpprod4960009","Fair-skinned Maid","FL",2,"I intended to use this product for covering blemishes, however I found that no amount of reapplying the product would hide them (specifically those that are raised). I would not recommend this product for use on small targeted spots, but rather for larger areas that are smoother like the under-eye area. I also recommend using with a powder because the product tends to be very dewy and sticky."
"http://www.ulta.com/colorstay-concealer?productId=xlsImpprod4960009","SolaraJ","Virginia",5,"I use this concealer as foundation, it blends so well.  Sometimes I add a tiny bit of Becca shimmer to get a completely natural look.  Either way, it is a great foundation or just concealer!"
"http://www.ulta.com/colorstay-concealer?productId=xlsImpprod4960009","Ref","Indiana",4,"I have used it for s couple of years. I like how it covers under my eyes and age spots"
"http://www.ulta.com/colorstay-concealer?productId=xlsImpprod4960009","Little Lin","Atlanta, Ga",4,"Definitely use this product with a wet beauty blender if you want it to blend easily. Also put a little on and blend it immediately because it dries fast if it isn't a thick layer. Also has a smell like that of acrylic paint, but it goes away after blending it in."
"http://www.ulta.com/colorstay-concealer?productId=xlsImpprod4960009","April","Colorado",5,"I use this for under eye bags, and blemish coverage.<br />It blends well, and is easy to use."
"http://www.ulta.com/colorstay-concealer?productId=xlsImpprod4960009","Natalee","La Mirada, CA",1,"I got the lightest shade because it matches me but as soon as I got home and searched it, it was literally a few shades darker than what I saw in the tube. I've never seen that before so I returned it the same day."
"http://www.ulta.com/colorstay-concealer?productId=xlsImpprod4960009","dee's screat weapon","huntley,il",5,"product goes on smoothly and conceals well with the medicine for acne it's really great."
"http://www.ulta.com/colorstay-concealer?productId=xlsImpprod4960009","Amanda","New York",4,"I wasn't big on concealer till last year. This was the first one I bought but I wanted to test out different ones also. I bought two more and ended up hating them and went right back to the Revlon Color Stay. I'm already on my second bottle too. It blends in very well and it's not a heavy concealer. The color matches my skin perfectly. The only downside is that it does not last the whole day. It will get me through a full school day which is 6-7 hours but it does not really last much more then that. Usually I will have to reapply later in the day if I put it on in the morning and then I'm going out somewhere later. Other then that I love it and I will keep buying it!"
"http://www.ulta.com/colorstay-concealer?productId=xlsImpprod4960009","Lauren","Louisiana",5,"I use this concealer everyday under my eyes, on blemishes, and around my mouth.  I don't use foundation, just the concealer in those areas and it blends perfectly. Love this product."
"http://www.ulta.com/colorstay-concealer?productId=xlsImpprod4960009","Sophia","Augusta, GA",1,"I am very disapointed with this product. I am an NC45 in Mac or a mix of Toast and Caramel in Revlon colorstay foundation so when I was looking through the concealers they offer they only had one for dark skin tones. I assumed because they had such great foundation that the concealer would go great with the foundation I already have. I was wrong the concealer I got was in the color deep and it looks grey on my skin. I put it under my eyes and on some blemishes and it's too dark for me but the next lightest one is too light so they don't make a concealer for someone they make foundation for. Even if this was the correct color this is a horrible concealer because it is too shear and easily wipes off because its so greasy."
"http://www.ulta.com/colorstay-concealer?productId=xlsImpprod4960009","Dallas Alice","Dallas, TX",5,"Good product"
"http://www.ulta.com/colorstay-concealer?productId=xlsImpprod4960009","Frostymeadows","Raynham MA",3,"I purchased this because it looked like it would be long wearing, and it is. I use it to cover a scar, and sometimes puffy eyes or other imperfections. It lasts but it does not cover as well as other products I have used."
"http://www.ulta.com/colorstay-concealer?productId=xlsImpprod4960009","Rachelle","Vista, CA",5,"I use this concealer under my eyes and on blemishes. It covers well and the coverage stays throughout the day. Very happy with this product!"
"http://www.ulta.com/colorstay-concealer?productId=xlsImpprod4960009","Rebecca","Chicago, IL",5,"This concealer covers my dark under eye circles very well.  It also stays put for an entire day! I have tried many brands to find a concealer that hides circles effectively and doesn't wear off, and I'm lucky to have stumbled upon this gem! Use a bit of powder on top and don't touch your face during the day, and this concealer stays put!"
"http://www.ulta.com/colorstay-concealer?productId=xlsImpprod4960009","Noel Day","San Antonio, TX",4,"I like to use this product under my eyes after I apply my foundation.  I like that it really brightens my under eyes.  I don't like how much work it takes to get it to blend well, but it will eventually."
"http://www.ulta.com/colorstay-concealer?productId=xlsImpprod4960009","Nikki","Detroit, MI",5,"Covers well and provides a good selection of colors for matching."
"http://www.ulta.com/colorstay-concealer?productId=xlsImpprod4960009","AleighLo","Elk Grove, Ca",2,"I didn't really care for this product. It didn't blend well with my color stay foundation. I only used it once and haven't used it since."
"http://www.ulta.com/colorstay-concealer?productId=xlsImpprod4960009","Katherine","St. Cloud mn",4,"Need a product that would cover blemishes I am 52 and  broke out after I came back from Mexico."
"http://www.ulta.com/colorstay-concealer?productId=xlsImpprod4960009","gracie","Columbia, SC",3,"I wasn't too impressed with this but it wasn't too bad either. It just doesn't really cover that well in the first place and doesn't stay either. It's also really liquidy and I prefer something creamier."
"http://www.ulta.com/colorstay-concealer?productId=xlsImpprod4960009","Noel Day","San Antonio, TX",5,"I used this under my eyes, and as my highlight for my bridal photos and I loved it.  It looked so natural and it stayed matte and didn't clup or crease."
"http://www.ulta.com/colorstay-concealer?productId=xlsImpprod4960009","Audrey","Portland, OR",5,"I love this concealor! It covers well, stays on for a few hours, and is a nice color if you get the right one. You'll have to carry it in your purse if you want all-day coverage though, and you're better off using light foundation under eyes. It's great for blemishes and such though!"
"http://www.ulta.com/colorstay-concealer?productId=xlsImpprod4960009","Arrielle","Atlanta",4,"this is a great concealer. Unlike high end brands that all come pritty much in yellow shades, Revlon has a variety of nuances.."
"http://www.ulta.com/colorstay-concealer?productId=xlsImpprod4960009","minnie","Grand Rapids, MI",1,"Under Eyes<br />The product comes out on the applicater in a giant<br />blob..."
"http://www.ulta.com/colorstay-concealer?productId=xlsImpprod4960009","neise","chicago",4,"really like acne healing benefits but blending into skin is hard. you can see the color is slightly different from normal skin color."
"http://www.ulta.com/colorstay-concealer?productId=xlsImpprod4960009","JennyGirl","Atlanta, GA",5,"I have used this as my concealer for years. It blends well, stays on, and does not settle into lines. My fav for life!!"
"http://www.ulta.com/colorstay-concealer?productId=xlsImpprod4960009","Nina","Fort Lauderdale, FL",4,"I would have liked the fair to be even lighter so I could use it as a contour since I am fair skinned. It was a great color to blend with the rest of my foundation"
"http://www.ulta.com/colorstay-concealer?productId=xlsImpprod4960009","kelleylovesboots","New York",5,"I discovered this in high school when I needed a concealer for blemishes.  After trying all the other drugstore brands with mediocre success, I tried this.  It was a bit more expensive than the others, but it WORKED.  You need to apply it in very thin layers, sometimes even using a q-tip for blending, but this will cover any blemish, broken capillary or spot.  <br /><br />I would not use it as an under eye concealer because it really dries out and would emphasize any fine lines.  It is not a moisturizing formula.  It stays put on oily or combo skin, and it does a great job, but not for under eyes.<br /><br />Seriously, this was a life changer when I disovered it and I am still using it about 15 years later.  Now that is staying power!"
"http://www.ulta.com/colorstay-concealer?productId=xlsImpprod4960009","Ashritha","Rancho crodova",5,"Love it"
"http://www.ulta.com/colorstay-concealer?productId=xlsImpprod4960009","Jill","Sarasota",2,"Bought because it was 'waterproof' but it comes off with the first tear."
"http://www.ulta.com/colorstay-concealer?productId=xlsImpprod4960009","Kelly Rose","Honolulu, Hawaii",1,"This is the worst product ever. Do Not Purchase This Concealer!! I have extremely sensitive skin and rosatia and when I put this under my eyes it felt like it was burning on my skin. It doesn't cover any blemishes, and if you have sensitive skin and rosatia it will sting and burn your skin terribly like it did to mine. I am not sure if I am allergic to an ingredient in this product, but it is terrible and a waste of money."
"http://www.ulta.com/colorstay-concealer?productId=xlsImpprod4960009","Jaz","Oklahoma",4,"I've been searching for an everyday concealer to replace my favorite NARS radiant creamy concealer and this is it! For an everyday concealer it works great and last throughout a full 8 hour work day without creasing or separating! Perfect for a subtle under eye highlight!"
"http://www.ulta.com/colorstay-concealer?productId=xlsImpprod4960009","deliosinta","New Zealand",5,"I've only used this concealer a couple times and so far it's working great! Underneath my eyes are quite dark but this covered it perfectly, I look much more awake and it still looks fairly natural on my skin."
"http://www.ulta.com/colorstay-concealer?productId=xlsImpprod4960009","angelkyz","El Paso, TX",4,"The applicator makes for easy application. Blends very well."
"http://www.ulta.com/colorstay-concealer?productId=xlsImpprod4960009","Kate","New Berlin, wi",4,"I have used this product over several different moisturizers, and it stays smooth- no<br />under eye creasing."
"http://www.ulta.com/colorstay-concealer?productId=xlsImpprod4960009","Beth","Dallas, TX",5,"Amazing for my undereye circles.  Grest coverage without creasing or settling in wrinkles."
"http://www.ulta.com/colorstay-concealer?productId=xlsImpprod4960009","Jean the dancing machine","Chino hills ca",5,"Blends well with my complexion."
"http://www.ulta.com/colorstay-concealer?productId=xlsImpprod4960009","KML","Skiatook OK",4,"I use it for dark circles as needed."
"http://www.ulta.com/colorstay-concealer?productId=xlsImpprod4960009","Mercedes","Monterey, CA",4,"I really like it, is smooth and easy to apply."
"http://www.ulta.com/colorstay-concealer?productId=xlsImpprod4960009","Rach","Hobart,IN",2,"I would have liked the concealer if it didn't crease after an hour of wear. I even set it, so dissapointed. I returned it."
"http://www.ulta.com/colorstay-concealer?productId=xlsImpprod4960009","Leann","North Carolina",1,"Even after setting it, it disappears."
"http://www.ulta.com/colorstay-concealer?productId=xlsImpprod4960009","kaymichelle","Colorado",1,"I got this concealer not so long ago, when I put it on for the first time it looked nice on the skin. But just after 30 minutes of wear it looked like I didn't even put it one. Not the best concealer, wouldn't recommend it to anyone."
"http://www.ulta.com/colorstay-concealer?productId=xlsImpprod4960009","Mirrored soul","Naperville, IL",3,"Concealer is one product I can't live without but this concealer didn't make me feel like it was doing a good job. I'm very acne prone and I wanted a concealer able to hide my dark spots and acne bumps"
"http://www.ulta.com/colorstay-concealer?productId=xlsImpprod4960009","M","Michigan",5,"I have spent quite a bit on many brands of concealers trying to find one that will compliment my skin and not draw attention to the fine lines around my eyes that come with age.  I am almost 50 and am finding that the older I get, the harder it is to find product to help improve my skin tone that feels good on my face and doesn't draw more attention to the laugh lines that have been gracefully earned around my eyes ;-).  This is a wonderful product."
"http://www.ulta.com/colorstay-concealer?productId=xlsImpprod4960009","Boots Bean","Carmel, IN",5,"I hadn't gotten into legit makeup until recently, 16 years with drug store makeup did me well. even though I'm buying nicer, more quality makeup, I will still continue to purchase this concealer."
"http://www.ulta.com/colorstay-concealer?productId=xlsImpprod4960009","NRB","Orlando, FL",4,"Good concealer that is easy to apply. Can be a little dry on dry skin. But overall good! Very good coverage. And I love that it is so easy to apply. I use a sponge to blend it in. Works perfectly."
"http://www.ulta.com/colorstay-concealer?productId=xlsImpprod4960009","Lo","Omaha, Nebraska",5,"I love everything about it"
"http://www.ulta.com/colorstay-concealer?productId=xlsImpprod4960009","Sueh","Murrysville,pa",5,"Cover up"
"http://www.ulta.com/colorstay-concealer?productId=xlsImpprod4960009","Angela the mom","Lakewood, CO",3,"It burns my skin"
"http://www.ulta.com/colorstay-concealer?productId=xlsImpprod4960009","Freckles","Cleveland OH",5,"Love this concealer!  I have some sun damage which translates to redness (similar to rosacea) &amp; dark spots. This concealer covers both very well in just one coat. I dab it on with the sponge tip applicator and blend it with my fingers. One coat covers perfectly."
"http://www.ulta.com/colorstay-concealer?productId=xlsImpprod4960009","CaityVanityy","Clearwater, FL",2,"THIS WAS SUCH A LETDOWN. I really liked the formula and how it felt on my skin, and it really blended well, and really covered up my spots, but after one day it broke me out :(( wouldn't recommend to acne prone skin at all!"
"http://www.ulta.com/colorstay-concealer?productId=xlsImpprod4960009","Kate O","Mass",1,"VERY thin product. As soon as I put it on my blemishes, my skin soaks it in, and I have to put on another coat, then another coat, and another... By that point, it's still not full coverage. I put my face powder on afterwards, hoping that will cover the rest, but it makes it SO obvious I'm wearing a ton of concealer. I'm returning this product as soon as I'm finished typing this."
"http://www.ulta.com/colorstay-concealer?productId=xlsImpprod4960009","Tiff","SF Bay area",4,"Overall, I like this concealer. It does work for both under eyes and blemishes, but I prefer it for blemishes and spots. I use the Revlon whipped creme makeup and I love it, for many reasons so I wanted to try the concealer to see if i would have good luck with that too.. (I wear the &quot;natural beige&quot; makeup, and got the concealer in &quot;light&quot; for under eyes and &quot;light medium&quot; for face spots and they work well together!) I am happy because I often have a difficult time finding a good color match. <br /><br />I prefer this type of applicator for concealers, it feels like it is easy to put the right amount where I want it. I am confident I can put it in my little purse size makeup bag without it making a mess.<br /><br />I have no complaints on the blemish and spot coverage. I am prone to flakiness- I am happy to say, this concealer doesn't dry me out and cause the flakes. I dot it on all the areas I want to cover, then use a brush to blend it, and its like my face, without the spots. <br /><br />It covers my dark under eye circles well and doesn't dry me out. It creases a little at first, especially if I use it on my lids to correct the color there since I get darker on the inner corners (but honestly, most concealers in that area do crease a little) I feel like it takes awhile to set on my eye area. The up side to that is it is easy to blend and doesn't set too quickly...For some, you could probably remedy this with a setting powder. I prefer to use a setting spray since i have combination dry/ acne prone skin; powders make me look dry and cling to blemishes- they look flaky and worse than they did before makeup."
"http://www.ulta.com/colorstay-concealer?productId=xlsImpprod4960009","Em","Columbia md",2,"A couple days ago I put this concealer on and it looked flawless what I put it on and half way through the day it turned into noticeable orange spots on my face. I tried it again to see if I did something to make it go like that but it happened again and again and again."
"http://www.ulta.com/colorstay-concealer?productId=xlsImpprod4960009","ashley","New Orleans la",5,"conceals well and so easy to apply will be buying this again"
"http://www.ulta.com/colorstay-concealer?productId=xlsImpprod4960009","JD423","Philadelphia, PA",5,"It's probably the thickest concealer I own, but as a result, it gives really great coverage."
"http://www.ulta.com/colorstay-concealer?productId=xlsImpprod4960009","yobri","Chicago, IL",1,"I absolutely love Revlon ColorStay foundation (whipped and regular) so I figured this would be just as great. WRONG! It's very easy to apply and there's a lot of product in the bottle but it doesn't blend well. Once I pat it into my skin, it settles in the creases immediately. After an hour, it breaks into sections on my face where you can see patches of concealer all over my under eyes. It also dries me out, especially on my forehead and above my eyebrows. I don't have oily nor dry skin, it is normal and I have found that my skin type is very compatible with a lot of makeup. I find myself trying to get my moneys worth using it again and again knowing that it's just going to ruin my face makeup. DO NOT WASTE YOUR MONEY. I feel like concealer will either be a hit or miss. Spend your money well elsewhere on concealer."
"http://www.ulta.com/colorstay-concealer?productId=xlsImpprod4960009","Sharon","Tennessee",4,"I use for undereye circles and occasional blemishes. I prefer this type of applicator because goes on easily."
"http://www.ulta.com/colorstay-concealer?productId=xlsImpprod4960009","dawn","madison wi",3,"only problem i had with this product was the smell. it smelt like a dead cockroach stuck in water. other wise the application and color was great. i only used it for my under eyes, basically to highlight my face."
"http://www.ulta.com/colorstay-concealer?productId=xlsImpprod4960009","crimsonrose51","Kilgore, Texas",5,"Great coverage. Easy to use. Easy to color match to my skin tone (very fair). Long lasting. Available for purchase at a lot of stores. However I don't like the applicator. If I touch applicator to an acne blemish then dip it into the concealer, it could get bacteria into the container. I deposit the amount of concealer to the back of my hand and apply with a concealer brush to avoid bacteria contamination."
"http://www.ulta.com/colorstay-concealer?productId=xlsImpprod4960009","Nicolec_","Diberville,Ms",5,"I use this product to highlight. I apply it in the morning and by the end of the day it still look great. I think this is a good product for a drugstore brand."
"http://www.ulta.com/colorstay-concealer?productId=xlsImpprod4960009","Vicky","Claymont, DE",2,"There is nothing to rave about this product!"
"http://www.ulta.com/colorstay-concealer?productId=xlsImpprod4960009","Marina","New York",3,"I have a strong dislike for revlon products. I feel like Revlon tries really hard to make a good product but then comes out with a really terrible one. this concealer is sheer which can be expected. Luckily it's just my exact skin color so I apply it as a triangle and then use a beauty blender to soften the edges of it then I set it really quickly for extra coverage around my dark circles. As a spot or discoloration concealer is better rather and an under concealer"
"http://www.ulta.com/colorstay-concealer?productId=xlsImpprod4960009","Nicole Adair","Vancouver, WA",1,"I got this thinking it might to as well as Revlon's ColorStay foundation.. And was pretty disappointed. Creases really bad under the eyes. May be better for spot covering."
"http://www.ulta.com/colorstay-concealer?productId=xlsImpprod4960009","Shann","Syracuse,ny",4,"This covers well but does not blend easily. It eventually blend with a lot of effort."
"http://www.ulta.com/colorstay-concealer?productId=xlsImpprod4960009","Emma","South Dakota",2,"This honestly was just okay. It didn't stay very well if your going to exercise all day. The light is also really tan for my skin, so I kind of looked weird with it on. This also really didn't conceal acne well and that disappointed me."
"http://www.ulta.com/colorstay-concealer?productId=xlsImpprod4960009","Venusprime","New Hampshire",5,"I bought this to use for contouring as it is a deeper shade. It works great!"
"http://www.ulta.com/colorstay-concealer?productId=xlsImpprod4960009","sparklesweetie","ohio",1,"The applicator is horrible, the concealer itself is watery and it doesn't dry easily. Total waste of money! Try maybelline fit me concealer."
"http://www.ulta.com/colorstay-concealer?productId=xlsImpprod4960009","Sam","Boston, Ma",3,"Horrible pigmentation, you could add four layers and nothing would show up. Leaves my under eyes looking very clumpy and cakey, and makes my skin look dry."
"http://www.ulta.com/colorstay-concealer?productId=xlsImpprod4960009","Ella","Florida",1,"I did not like this product because when i wore in through out the day it only stuck to my dry patches and did not stay on anywhere else, it also had very poor coverage, I have medium acne and it covered nothing."
"http://www.ulta.com/colorstay-concealer?productId=xlsImpprod4960009","Ally","Moulton, AL",5,"Goes on easy and smooth!"
"http://www.ulta.com/colorstay-concealer?productId=xlsImpprod4960009","Lou","Benton, Louisiana",5,"Use to remove dark circles under my eyes. And also to highlight my brows"
